videoId,titulo,bucket
b3RXjB9ZxvU,A TORTA DOCE MAIS FÁCIL DA SUA VIDA! TORTA RIDÍCULA,parcial
ELZLHU59PJ0,DA PRA CORTAR COM UMA COLHER DE TÃO MACIO  CUPIM COM CERVEJA NA PANELA DE PRESSÃO,parcial
7PXCJPxxK_o,Das schmeckt besser als ein Burger! Ihre Kinder werden es Ihnen danken!,parcial
-mbdNUdYDEw,TORTA DE BANANA MAIS FÁCIL DO MUNDO | Léo Abreu,parcial
IZldvdsBt0U,Pipoca doce super crocante | PIPOCA COM CARAMELO CROCANTE,parcial
di9n6Wu2D0o,Seit diesem Rezept macht keiner mehr Schnitzel! Knusprige Hähnchenbrust in Parmesan-Soße,parcial
wxhfSzzLylo,RECEITA DE CONSERVA DE CEBOLA DELICIOSA!,parcial
qA--XRtsnQ0,Crispy Garlic Lemon Sweet Potato Fries | Easy  Healthy & Flavorful Homemade French Fries,parcial
3uU3garE82Y,Cuando tengas espagueti y atun. Prepara esta deliciosa receta de pasta en tan solo unos minutos,parcial
LMNbjrvVDtM,Delicioso drink de Melancia com Hortelã sem álcool 🍉 😋,parcial
Zv-U5lD6X88,Macarrão à Matraciana | Léo Abreu,parcial
U9Y7hKfbBmk,Nur 1 Tortilla! Schmackhafter als Pizza! Unglaublich leckeres Frühstück  Mittag- oder Abendessen,parcial
ihTVBZprtIA,Bistek   Pasta Alho e Óleo | Thalyta Koller,parcial
gSu2xeDzqao,🇮🇹 Diese italienischen Wraps machen alle verrückt 😍 So ein schnelles und köstliches Rezept!,parcial
xJoipJjIcBI,Gefüllte Hähnchenrouladen mit Parmaschinken & Käse – So saftig & lecker! 🧀🍗,parcial
4UTrEpVKhKM,91 year old Maria shares her lasagna recipe with Pasta Grannies!,parcial
JEUCJ11JixU,Choripan com um Toque Especial | Léo Abreu,parcial
lMVi61jGTPs,Easy Focaccia Bread Sandwich,parcial
5vXcFy9169g,Pão de mel na travessa | Leo Abreu,parcial
R0qP5NfpccI,Torta de Frutas Vermelhas SUPER RÁPIDA e DELICIOSA! | Léo Abreu,parcial
-ISR6hwYYgc,SPAGUETTI ALL’ASSASSINA | O espaguete assassino :),parcial
a1BUvsppg6E,Schokoladenkuchen in 5 Minuten! Jeder sucht nach diesem Rezept!  Kein Backen  keine Gelatine!,parcial
R90P-uc4v4Q,Dieser Kuchen ist so lecker  dass ich ihn jedes Wochenende! Kein Mehl  kein Ofen  keine Eier,parcial
ro2JBNBOeL0,Nutella de Fraises : 3 Ingrédients / Si Addictif que vous le Cacherez aux Autres !,parcial
xIQXLTFup6M,The Real Lasagna is Bolognese,parcial
XWMkBiM62K4,COSTELA PERFEITA PARA CEIA DE NATAL OU ANO NOVO!,parcial
4hYUrBh0Sls,LASANHA À BOLONHESA | Mohamad Hindi,parcial
uNKThDwml5Y,Sanduíche suculento de carne com queijo | Léo Abreu,parcial
7vSKayIHlQQ,Aprenda um delicioso salgado folhado | Léo Abreu,parcial
sF7WTs6RKg0,TULIPA DE FRANGO NA CHURRASQUEIRA | GoHanCOOK,parcial
h9HbJ9wRguI,Essa farofa vai fazer sucesso no seu churrasco | Léo Abreu,parcial
QaOay1_Cdjg,O QUINDIM PERFEITO EXISTE! (Receita tradicional rápida e fácil) | GoHanCOOK,parcial
BuxggshkyxQ,Estrogonofe Fácil,parcial
d-DYYCIZhww,A MELHOR RECEITA DE SHAKSHUKA C/ ESPECIARIAS :: UNDERCHEF,parcial
UlbRbVJf3uo,FATIA HÚNGARA - Receita de pão doce de coco com miolo molhadinho,parcial
ByVy1goGqGE,YAKISOBA MISTO DE CARNE E PORCO CARAMELIZADO :: UNDERCHEF,parcial
P3E048igCI0,CHEESECAKE DE GOIABADA LEVE E CREMOSA | FÁCIL E SEM GELATINA,parcial
tt0EZL6Xdng,A torta de frango mais fácil do canal | Léo Abreu,parcial
estCyu5MUl0,Cheesecake de Goiabada cremosa #natal  #anonovo #merychristmas,parcial
2hvN0bzjBxw,SONHO DE PADARIA COM MUITO CREME  PRÁTICO DE FAZER | Thigas Ribeiro,parcial
IsMl5Mo0bho,ZERO CARBOIDRATOS! Pode COMER MUITO e AINDA EMAGRECER! Delícia Sem FARINHA  Fácil  Rápida,parcial
-HJZV6CMcos,Crepe com doce de leite | Temporada de Inverno | Léo Abreu,parcial
wl59onmtfBk,BIFUM COM CAMARÃO PICANTE,parcial
PS52QiIJq4Q,OS SEGREDOS DA MINHA PASTA AL POMODORO!,parcial
5bsf7-zyTXU,A MELHOR PALHA ITALIANA GOURMET QUE VOCÊ VAI COMER,parcial
23pYmhD0MTE,Chegou o dia da lasanha! Vem aprender como faz | Léo Abreu,parcial
FGq6h49rJAY,Receita de Brownie Fácil,parcial
rH9yeve8-NY,CALZONE RECHEADO COM QUEIJO  COGUMELOS E LINGUIÇA BLUMENAU! TEMPORADA DE INVERNO 2023,parcial
SRmkI7Heens,Receita de Sopa de Tomate,parcial
ZezfTCAay6o,A MELHOR MASSA DE PIZZA DE FRIGIDEIRA :: UNDERCHEF,parcial
tYwWfxU9JD4,Forget about the rice pilau! Discover how to cook the rice with chicken legs - into the oven,parcial
peRxnGx6aC8,🍫 Creme de avelã com chocolate: a versão caseira da Nutella! | GoHanCOOK,parcial
992JEu1hq6k,ROCAMBOLE PRESTÍGIO QUE NÃO VAI NO FORNO,parcial
jhayaOZELLk,MAIONESE SAUDÁVEL SUBSTITUI PERFEITAMENTE A TRADICIONAL!,parcial
x-8UQAgbiPE,Especial Dia dos Namorados: Ravioli Recheado! | Léo Abreu,parcial
U1psBgorfhc,COMO FAZER CUPIM DE FORNO EM CASA + SANDUBA LARIQUENTO CHEFUDO!,parcial
4aNk6o1XngM,SANDUÍCHE DE FRANGO A MILANESA!,parcial
OjusPTl6dco,A RECEITA DO MOUSSE DE CHOCOLATE DO MEU RESTAURANTE! #mousse,parcial
poZem-hCM7A,TULIPA COM SHOYU: suculenta  saborosa e deliciosa 😋 (receita do meio da asa de frango) | GoHanCOOK,parcial
hriaMix3kmI,Aprenda os truques do Bife Acebolado | Léo Abreu,parcial
ocBXUUePuUA,Aprenda a autêntica Massa Alfredo com apenas 2 ingredientes | Léo Abreu,parcial
j8KGOxk3WIo,Como nunca errar seu Pudim perfeito 🍮 | GoHanCOOK,parcial
Fkkb-HaFCSE,RIGATONI ALLA PUTANESCA,parcial
VBsmoria-hc,Como fazer MACARRÃO AO PESTO #pesto #paraense #shorts,parcial
sw8kTcm1yCw,Petisco imperdível: Batata com Bacon! | Léo Abreu,parcial
r6QWxOcRLDI,Shakshuka  o café da manhã perfeito (receita rápida e fácil de ovos com molho de tomate) | GoHanCOOK,parcial
KLEH8RJsYgI,Building a Lego-powered Submarine 4.0 - automatic depth control,parcial
klb8wC-Jkao,Parmegiana com 4 Queijos em apenas 15 minutos | Léo Abreu,parcial
pM-koHMEl8I,CUPIM DESMANCHANDO SEM BRASA E SEM PAPEL ALUMÍNIO! FÁCIL DE FAZER EM CASA NO DIA A DIA!,parcial
dFQYDs9fMWg,Macarrão fácil e rápido com filé mignon | Léo Abreu,parcial
c7Df4Zann-w,Sanduíche de frango para quem está com pressa! | Léo Abreu,parcial
zFL9PeqUz20,Filé de sobrecoxa desmanchando ao molho de espinafre | Léo Abreu,parcial
E82d6lCMQHU,O MELHOR FRANGO EMPANADO | GoHanCOOK,parcial
K4W-8x5Ady0,Petisco rápido: Bruschetta de Tomate! | Léo Abreu,parcial
DaKW60eianw,Sanduíche de bacon BLT crocante em menos de 15min | Léo Abreu,parcial
Vd9cGoeaLPo,Não existe torta de frango mais cremosa que essa | Léo Abreu,parcial
sl9Wyw3t0_s,PEITO DE FRANGO SECO NUNCA MAIS COM ESSA RECEITA  | Léo Abreu,parcial
yA3CihOhHiQ,O bolinho de arroz mais gostoso | Léo Abreu,parcial
KHlohgpgYlM,O VERDADEIRO MOLHO ROMESCO | Léo Abreu,parcial
5SGqGWbvqeA,Uma delícia para o Natal: torta de palha Italiana! | Léo Abreu,parcial
WM3znprPsNs,RABANADA CROCANTE  CREMOSA E MACIA por Felipe Castanho,parcial
7b45yqwal2M,BATATA ROSTI FÁCIL E DELICIOSA,parcial
J4d1wSiof9M,👶 Ninguém segura este bebê! Revelamos a receita da melhor maionese do mundo #shorts,parcial
3q_JRcTcAKo,Cook Super Easy Restaurant-Style Mongolian Chicken 蒙古鸡丁 at Home! Chinese Chicken Recipe,parcial
4scbsNSKsmQ,🍞 O melhor sanduba da sua vida tá aqui  com receita e tudo #shorts,parcial
KtXcCHw7bj4,Finalmente  Carbonara!,parcial
Er7b4ii-uhQ,ALMOÇO SIMPLES E SAUDÁVEL!,parcial
mk3uiTvOsxM,Mars-Kuchen  der auf der Zunge zergeht! Einfach und sehr lecker! 😋,parcial
69tjHhkk-4o,Duelo de titãs: strogonoff de frango ou de carne? | Fiz e Comparei | Léo Abreu,parcial
KxpBohu8eKs,MACARRÃO COM MOLHO DE QUEIJO E ESPINAFRE,parcial
57IYca0yin8,Espaguete ao molho 4 queijos mais fácil da Internet | Léo Abreu,parcial
V1vJlTGH17I,PETIT GATEAU DE DOCE DE LEITE!,parcial
vXBlVxfrybE,COMO FAZER CHOCOLATE QUENTE | Receitas do Will,parcial
ZFVXlJqNR3k,Snickers-Kuchen  der auf der Zunge zergeht! Einfach und sehr lecker! 😋,parcial
xp70JBfOzP8,Frango agridoce e picante como você nunca viu igual | Léo Abreu,parcial
OLp1Jax8UT0,THIS KILLER PORK RECIPE IS VERY SIMPLE!!! ANYONE CAN COOK THIS AND THE RESULT IS REALLY AMAZING!!!,parcial
Iv0GOJVFyu8,PÃO DE BATATA COM CALABRESA E CATUPIRY!,parcial
oh2Z5fXkV4Y,SANDUÍCHE GOSTOSO E FÁCIL DE ALMÔNDEGAS | Léo Abreu,parcial
g-SWW9qqUbY,ALMONDEGA FÁCIL E RÁPIDA!,parcial
v_vtq0fKfhc,VOCÊ FEZ FRANGO XADREZ ERRADO A SUA VIDA INTEIRA | GOHANCOOK,parcial
-54xKD-RCKY,COMO FAZER CALZONE | EP04 - O FANTÁSTICO MUNDO DA PIZZA,parcial
AFC52eKyidA,Take oats  cocoa and bananas and make this amazing dessert! Gluten free  NO sugar!,parcial
013VCqMXWfo,Diese Pasta Bolognese hat mich verrückt gemacht! Herzhaft  einfach und unglaublich lecker!,parcial
wZjJvTdKY2o,진짜 바삭한 쌀 닭강정 만들기 :: 매콤달콤 황금 양념비율 :: 부드러운 순살 닭강정 :: Sweet and Crispy Korean Chicken :: Dakgangjeong,parcial
HV5knNGRsyw,Receita deliciosa de arroz de frango gratinado | Léo Abreu,parcial
rB7CJpyPS7E,EASY HOMEMADE CHEESE SAUCE RECIPE || NACHO CHEESE SAUCE RECIPE | How To Make Nacho Cheese Sauce,parcial
KZKpTufNNDE,Das ist die leckerste Hähnchenbrust  die ich je gegessen habe! Einfach  günstig und sehr saftig!,parcial
1QpJOrVdtNU,Quick Strawberry and Banana Smoothie Recipe with Yogurt #Ad,parcial
Fhdtci1vN1Y,Receita de sanduíche de atum com queijo  mais fácil impossível | Léo Abreu,parcial
DJbjCYUOFPU,BRUSCHETTA DE FRANGO PICANTE!,parcial
3vCeoz5mzjQ,SANDUÍCHE DE ATUM NA BAGUETE!,parcial
0nfndp_-ilk,Molho Sweet Chilli - Pimenta agridoce #Shorts,parcial
h0v-lzW5Sdg,AREPA DE QUEIJO - Receita rápida  sem glúten e sem sova,parcial
clMENn4SoAQ,MACARRÃO ALHO E ÓLEO | Cozinha Básica,parcial
PCoAElC4Avg,RABANADA FRANCESA? French Toast | Léo Abreu,parcial
Lm0Qcxyeg6I,MOLHO DE PIMENTA SALSA ROJA | COMIDAS MEXICANAS EP 05,parcial
4OSZHgAsQfk,EU NÃO IMAGINAVA QUE ERA SÓ BATER NO LIQUIDIFICADOR 😱 RENDE 2 LITROS 🔥💰,parcial
G86TGx2C_ug,COMO FAZER BURRITO DE CARNE | COMIDAS MEXICANAS EP04,parcial
xp6ZxboH4LU,3 RECEITAS DE SANDUÍCHE: aprenda a fazer recheios diferentes com carne  frango e peixe,parcial
g028MGRdHEE,SANDUÍCHE FÁCIL! | BAGUETE COM QUEIJO  SALAME E MOLHO ESPECIA!,parcial
9rBDW3dS_J0,Homemade Magnum Ice Cream 自制梦龙冰淇淋雪糕 Glace Magnum fait à la maison,parcial
x9Efqojfb3A,👍👍👍 Waffeln mit Nutella mischen! Sie werden von diesem Rezept überwältigt sein! KEIN Backen!,parcial
W4XVyB7dw6Q,BRIGADEIRO SIMPLES E BEM FEITO!,parcial
XwRhuBhR8xo,COMO FAZER SANDUÍCHE BLT | BACON  ALFACE E TOMATE,parcial
I3gGGt3uR7E,Avocado Toast c/ ovo pochê e bacon crocante | Léo Abreu,parcial
I9DsdvTnPbo,SCHNITZEL (ou milanesa suino) com purê de maçã | Léo Abreu,parcial
NZkU9GZPSCU,Hambúrguer de gorgonzola com picles de uva | Léo Abreu,parcial
gcP78-E6Sac,BUTTER CHICKEN 🔥,parcial
QWeXVaPfMVA,Das Lieblingsrezept meines Mannes zum Abendessen! Einfach und sehr lecker!,parcial
aCh5WdCKBuE,ESFIHA DE QUEIJO - Receita fácil do chef José Carlos,parcial
qnEAr_D-Qgg,Tomato Soup Recipe with Canned Tomatoes #Ad,parcial
ViZ_8AKeZ_k,LASANHA INSPIRADA NO ANIME ONE PIECE! | GOHANCOOK,parcial
EMtDfCrTuTQ,MACARRÃO COM LINGUIÇA | Léo Abreu,parcial
fTgm36y884c,How To Cut Every Cheese | Method Mastery | Epicurious,parcial
k4p1VNtm37U,Caesar Salad por Alex Atala,parcial
iSLlz8Yn03I,Parei de comprar panettone  ninguém vai acreditar que você fez isso em casa,parcial
21yDx3LIKhM,Torta mousse de limão com chocolate,parcial
7zh5WcSPOc4,Chipotle Honey Wings | The Golden Balance,parcial
uOjoKFcVZfg,MACARRÃO ALLA PUTTANESCA (MINHA PRIMEIRA VEZ) | Receitas | Mohamad Hindi,parcial
VCu4IPwJBmw,TORTA DE CHOCOLATE COM WHISKY E CARAMELO!,parcial
P7GpjhHpE04,Tender Fácil com Abacaxi e Bacon,parcial
TEelLPHpK2o,COMO FAZER BOLINHO DE QUEIJO(MUSSARELA STICK) #shorts,parcial
EFfuczc9cm0,COMO FAZER MOLHO DE PIMENTA #shorts,parcial
OtiNCusTo2Q,APERITIVO ITALIANO INDISPENSÁVEL!,parcial
YD1Hk31UDs0,COMO FAZER OVO POCHÊ SEM COMPLICAÇÕES | Léo Abreu,parcial
8LPvP4GXLGE,Almôndega de Frango,parcial
PE7ILABPJqM,How to Make The Crispiest Korean Wings in 3 Flavours 三味韩式炸鸡翅 Crunchy Fried Chicken Wing Recipe,parcial
Jf7ik94_XnI,Ich habe noch nie so einen leckeren Fisch gegessen❗ Zartes Rezept  das einem auf der Zunge zergeht!,parcial
fjYdgeKsSLM,Einfaches Rezept! Kartoffeln mit Hackfleisch! Die ganze Familie wird es lieben!,parcial
LJ94-ePU0Zc,PASSATA DE TOMATE CASEIRA!,parcial
8Cyl4M_RJTI,Rocambole com Massa de Pastel,parcial
5K_yGFKzWMA,KARAAGE  O FRANGO FRITO JAPONÊS MAIS FAMOSO! | GOHANCOOK,parcial
1F5FnaEI5qw,KOROKKE O BOLINHO DE BATATA JAPONÊS COM HONDASHI®️ | #shorts,parcial
yDTv1_B0gzs,Einfach die Eier und Zwiebel auf diese Weise braten und das Ergebnis wird köstlich! Neues Rezept,parcial
TlE1kpcLUbc,Quindim,parcial
UU9pJGgBRmE,Salada gostosa? Conheça a Caesar Salad | Léo Abreu,parcial
qeZjG1j_1Vc,TORTA HOLANDESA | Will Inácio | Doces,parcial
HoN1EVqpl4I,SANDUBA PRA SALVAR O JANTAR | CONTRA-FILÉ COM MOLHO DE GORGONZOLA | Leo Abreu,parcial
2Stnv_cErvE,Léo ensina o melhor acompanhamento pro cafézinho: Pão de Queijo | Léo Abreu,parcial
34lGvp0kTrY,COMO FAZER FRANGO DO KFC EM CASA - SEGREDOS REVELADOS,parcial
Q1FNiTLAWfM,MOUSSE DE CHOCOLATE COM 2 INGREDIENTES | Mohamad Hindi,parcial
h0xZGQBqysU,MAIONESE VERDE DE LANCHONETE!,parcial
Vk-NfwCmDJY,Bolinha de Queijo com 3 Ingredientes,parcial
UCN80XqIU1c,So gut  dass nichts mehr auf dem Tisch liegt! Köstliches spanisches Kartoffelomelett!,parcial
blVZcaXhSRA,O MELHOR PÃO RECHEADO DO MUNDO!,parcial
uD3qHdyFny4,O CANNOLI QUE VOCÊS PEDIRAM! TEMPORADA DE INVERNO EP4,parcial
n3dPc17He9I,MACARRONADA COM FRANGO ASSADO | Temporada de inverno | Léo Abreu,parcial
IJxW-OoBIKM,Juicy  healthy oven baked chicken breast recipe! Easy and delicious!,parcial
ZsR2k0R-MHY,MACARRÃO À MATRICIANA | TEMPORADA DE INVERNO EP2,parcial
_gZy43hwAoo,BERINJELA À BOLONHESA | TEMPORADA DE INVERNO | EP1,parcial
fpX5DlZ94VQ,NHOQUE DE BATATA À BOLONHESA!,parcial
sZ3txThvaho,COMO FAZER BRUSCHETTA #shorts,parcial
6wCI6B9sxd0,SANDUICHE DE CARNE COM MOLHO PICANTE!,parcial
0hv63c6obDY,O Melhor Suflê de Queijo do Chef Taico,parcial
pM-6cP6T7m4,ARROZ DE FRANGO COM MOLHO ESPECIAL!,parcial
ibL4yPFxuKQ,PÃO DE HAMBÚRGUER CROCANTE TIPO DO MADERO | SÓ QUE MELHOR,parcial
vWJDjYCl8io,Authentic Bolognese sauce  that Nona will love,parcial
HWxzOAQb7Ss,MASSA PARA EMPANADAS | MAIS FÁCIL IMPOSSÍVEL,parcial
8-0dHxzqCKY,COMO FAZER GELÉIA DE PIMENTA | Leo abreu,parcial
73LqUjGBQ9w,OMELETE TORNADO DE 20 MILHÕES DE VIEWS | Receitas Internéticas | Mohamad Hindi,parcial
MdkhLO66Vgk,Linguiça Recheada com Ovo,parcial
nFL7RRPwUu8,MACARRÃO CACIO E PEPE | Segredos pra não errar | Léo Abreu,parcial
4BTm1Ezl6XE,Carnivorous Chili & Vegetarian Chili | Basics with Babish,parcial
9PWomdbZi2U,Donuts | Basics with Babish,parcial
J_3v7DEkjsk,Pan Pizza | Basics with Babish,parcial
jX_HGN8wrdw,MACARRÃO AO LIMONE | Receitas Vegetarianas | Rafael Ribas,parcial
E0G5Y2SOW0c,Quesadillas | Basics with Babish,parcial
Stfm8DLH-jA,O MELHOR PICLES DE PEPINO PARA SEU PÃO COM MANTEIGA | BREAD & BUTTER PICKLE,parcial
qoHnwOHLiMk,Carbonara | Basics with Babish,parcial
0SxZPwvDGSw,NUGGETS COM MOLHO ORIENTAL | Antes e Depois | Mohamad Hindi,parcial
qLgiNe9YrmE,RUSSA ENSINA RECEITA DO STROGONOFF RUSSO ORIGINAL | O MELHOR ESTROGONOFE DO MUNDO!🔥,parcial
Z4Wuadqo8-I,Molho Pesto,parcial
fBrth2aeqqI,COMO FAZER MOLHO PESTO | Dicas e truques | Léo Abreu,parcial
yjY-dK4JS-k,바삭함의 끝판왕  피자롤 :: 초간단 피자만들기 :: 롤피자 :: 피자스틱 :: Deep-Fry Pizza Rolls :: No oven Pizza,parcial
jG75GbL9BcA,Chocolate Muffins,parcial
QTFjFayRjtw,BREAKFAST EGG SANDWICH HACK | Crispy One Pan Egg Toast,parcial
P0IESUuRzo0,CHIMICHURRI | O mais pedido do canal,parcial
5ID9PBYoSxI,PUDIM DE LEITE SEM FORNO | Receitas | Mohamad Hindi,parcial
wrnej4DANv4,ESPAGUETE À CARBONARA | Dicas para impressionar | Léo Abreu,parcial
DUK94oQGmLc,1 Hora ~ MACARRÃO À BOLONHESA SEM ATALHOS | Léo Abreu,parcial
P-cseza8K0I,쉬운재료로 에그 부리또 만들기 :: 계란요리 :: Egg Burrito :: Breakfast Recipe,parcial
iwxJTIxIoFo,Pancake 4 Ways  | Jamie Oliver,parcial
vhMpPoVC_e4,ARANCINI RECHEADO COM MUSSARELA!,parcial
DvX157hWcPw,LEITE NA PIPOCA -FICA MELHOR QUE A PIPOCA DE CINEMA- CARAMELIZADA,parcial
xPCyqUkNfBg,FISH AND CHIPS PARA O VERÃO!,parcial
Ukju__v7AEI,Dadinho de Leite Ninho,parcial
Kio-UedgFQs,LINGUIÇA CALABRESA ACEBOLADA | Receitas | Mohamad Hindi,parcial
c34TbcJJgSo,PARMEGIANA DE FRANGO TOP | Léo Abreu,parcial
9nn6LfnQmSk,TORTA DE BANANA FLAMBADA E MASSA FOLHADA!,parcial
87FSk2AGhtI,Everyone Who Tried  Loved it! Super Yummy Sweet & Sour Shrimp 酸甜虾球 Chinese Crispy Prawn Recipe,parcial
V3YlN183NqA,KIBE FRITO | Receitas | Mohamad Hindi,parcial
s6QLuSnAWjw,FAÇA SEU PÃO DE ALHO PARA CHURRASCO!,parcial
5ubPrQIn4wA,MACARRÃO NA PANELA DE PRESSÃO  SERÁ QUE DÁ CERTO? | Receitas Internéticas | Mohamad Hindi,parcial
78d0BBht0lo,CHILLI CON CARNE E SALSA CASEIRA,parcial
AoaTFhq2AN8,Paçoquinha de Rolha  Apenas 3 Ingredientes!,parcial
945nkfyGAH4,BOLINHO DE ARROZ SIMPLES | Receitas | Mohamad Hindi,parcial
aQmCk4Fvccg,FRANGO TURBINADO E MUITO RECHEADO!,parcial
OrE9CzrMATg,“O” SANDUÍCHE DE MILANESA COM MOLHO ESPECIAL!,parcial
roKJcIbxNOc,PÃO DE BATATA COM 4 INGREDIENTES | Receitas Internéticas | Mohamad Hindi,parcial
xLPXD39RieI,COMO FAZER ALMÔNDEGAS DE CARNE | Leonardo Abreu,parcial
jP_xuZo94tI,SALADA DE BATATA PERFEITA!,parcial
Lr2RHeaPB00,PÃO DE QUEIJO COM 3 INGREDIENTES 🧀 | Receitas Internéticas | Mohamad Hindi,parcial
CFye-J98IVY,O BIFE À MILANESA PERFEITO!,parcial
JCMHfZz9KL0,NÃO FAÇA UM PRATO VEGETARIANO ANTES DE VER ESSE VÍDEO!!,parcial
T5kbSAMZMYM,APRENDA A FAZER UM ESPAGUETE CACIO & PEPE DIFERENTE!,parcial
_dmncD48w_M,BLONDIE DE SNICKER COM MUITO RECHEIO,parcial
-28szjdak3E,PÃO DE QUEIJO RECHEADO COM DOCE DE LEITE! 🥵,parcial
0MJep0plDlw,O MELHOR PUDIM DE LEITE! | Técnicas | Léo Abreu,parcial
lEb-OU3sHfI,Batata Crocante Temperada de Forno,parcial
546eNWOzSFQ,YAKISSOBA ESPECIAL | Leo Abreu,parcial
2fWJyYKqHmQ,MACARRÃO CREMOSO | Comidas Favoritas | Léo Abreu,parcial
MKx4aO3BYL4,TOMATE CONFIT | Técnicas,parcial
PAXMm2QCnlg,PANQUECA DE CARNE COM CATUPIRY! | Rango de casa,parcial
32pcP7ayRw4,Pizza Napolitana Caseira,parcial
gv-68QxidSk,Melhor Massa para Esfirra | Fermento Natural,parcial
9Pmg3iWcnDk,COMIDA MEXICANA  Chilli de carne autentico fácil,parcial
iapaeO4ig3Y,3 TIPOS DE OVO MEXIDO CREMOSO  O GUIA DEFINITIVO! | Cozinha Básica | Mohamad Hindi,parcial
8uxhPWCvHF4,O Melhor Lanche de Frigideira do Mundo,parcial
48liYhR8U2Q,COOKIES RECHEADOS - OS MELHORES QUE JÁ FIZ NA VIDA! | BELLARIA | RAQUEL CICOLIN,parcial
S7pRhg39kWs,PRIME RIB SUÍNO | Léo Abreu | Cortes nobres,parcial
HtlMZ0ZBrAo,The Best BBQ Sauce | Jamie & Buddy Oliver,parcial
E6DzLagzsFE,Make Southwest Chipotle sauce like Subway at home !! Simply yummylicious | Subway sauces,parcial
jFfcYgcYkhE,COMO FAZER BATATA CHIPS COM TEMPERO ESPECIAL! | Técnicas,parcial
q4ah4J_vSig,Esfirra (esfiha) aberta de carne,parcial
7BFNXj2AwGU,CREME BRÛLÉE 3 INGREDIENTES | Sobremesa | Jantar Romântico Parte 03,parcial
JebbRPkw0Do,CONCHIGLIONE RECHEADO AO MOLHO DE COGUMELOS | Prato Principal | Jantar Romântico completo parte 02,parcial
d0skrmvxG-I,PANQUECAS AMERICANAS SUPER FÁCIL E DELICIOSAS,parcial
mEfutuiHoUM,NÃO FAÇA OVOS ANTES DE VER ESSE VÍDEO!,parcial
maFD34H9XTA,A MELHOR MOUSSE DE CHOCOLATE DO MUNDO!,parcial
_s-q-46qcZw,CHOCOLATE QUENTE MUITO CREMOSO E SUPER FÁCIL I Receitas de Pai,parcial
JsdQ7eVjFio,BOLINHO DE ARROZ MUITO CREMOSO COM PRESUNTO E QUEIJO!,parcial
9r9IUX6u8VU,ESFIHA TIPO HABIB´S - RECEITA PARA NÃO ERRAR,parcial
tsTZfx4CwE0,MARIDO GELADO A MELHOR SOBREMESA QUE JÁ COMI !!!,parcial
fJVAxuK9sok,How to make Pesto | Gennaro Contaldo | 🇮🇹 🙏❤️,parcial
IEgsCKo5wtI,SOBREMESA FÁCIL E BARATA - PRONTA EM MENOS DE 7 MINUTOS! SERÁ POSSÍVEL? 😱,parcial
UvoleP1-_I0,Super Easy Chinese Honey Chicken 蜜糖鸡 Orange Chicken & Panda Express Inspired Chinese Food Recipe,parcial
aQeA-WV8xf4,Esfirras Árabe  Mais Fácil de Fazer que Existe,parcial
ONJoGtyIOI8,Only 3 Ingredient Double Chocolate Mousse in 20 Minutes,parcial
3P2YxhWadaM,ROCAMBOLE DE CARNE COM BACON DELICIOSO E PRÁTICO | ODEIO COZINHAR,parcial
XZ5OG0dtbrk,Homemade Sauce Bolognese - Easy & Delicious Recipe for Spaghetti al Ragu,parcial
mOjkzQCMuuc,PÃO PITA (Pão Sírio ou Árabe): Receita fácil para assar no forno ou na frigideira,parcial
LgoLq8oAKhY,CEBOLA CARAMELIZADA PERFEITA | Cozinha Básica,parcial
XWoTfQGTSFM,Easy& Healthy Orange Chicken,parcial
Y2fpFrMQg5Y,COMO FAZER MOLHO BRANCO | Cozinha Básica,parcial
SdLy8VbbJHE,BOLONHESA RÁPIDO E FÁCIL | Cozinha Básica,parcial
6GmabBa0B2s,FILÉ DE FRANGO À PARMEGIANA,parcial
x7njQWhBpnc,COMO FAZER MOLHO VINAGRETE | Cozinha Básica | Mohamad Hindi,parcial
rwyEPcWUR60,NÃO FAÇA BATATA ANTES DE VER ESTA RECEITA | BATATAS ASSADAS CROCANTES,parcial
nAWHwvnO5SY,PÃO CASEIRO PARA INICIANTES: Receita fácil para quem nunca fez pão,parcial
xKDZMWTG5Xw,ARROZ CREMOSO DE FORNO COM CAMARÃO!,parcial
Ms0VD532MLY,BATATA RÚSTICA ÉPICA!! DICAS E SEGREDOS!,parcial
u6X8wDKDn7o,CHEESECAKE DE NATAL! | SIMPLES E FÁCIL!,parcial
Dipxc-jAkl4,O ASTRO DA SUA CEIA | COMO FAZER PORCHETTA!,parcial
P4qjejEdOZ4,3 TIPOS DE FAROFAS PARA O NATAL | CEIA DE NATAL 2019,parcial
KCe85lhkfOg,Pão Francês Artesanal Saudável,parcial
kN5oqa_6O6U,CEIA DE NATAL 2019 | BURRATA FRITA!,parcial
vXmoSs-qJik,COMO FAZER BATATA GRATINADA | Cozinha Básica,parcial
UWcu0km3XLg,Filé de Lombo à Milanesa com Tomates Grelhados - Web à Milanesa,parcial
_qy6HNqxhKU,How to make Bolognese | Gennaro Contaldo | Italian Special,parcial
JPqIS_BsLWk,O MELHOR COOKIE RECHEADO DO MUNDO! feat Valentim,parcial
qsghxhVBzNU,NÃO FAÇA MACARRÃO ANTES DE VER ESSA RECEITA! | clickbait o retorno,parcial
EmnL4TD2hCY,COMO FAZER CROQUE MADAME | SERIA A EVOLUÇÃO DO MISTO QUENTE? :),parcial
jIAIbhtA1qY,Melhor receita de Frango Cremoso! Frango Gratinado ao Molho de Queijo Gorgonzola,parcial
Kveb_zeeu50,O MELHOR MOLHO DE TOMATE DO MUNDO!,parcial
OgOMW_QbCuI,COMO FAZER MOLHO DE PIMENTA | SEGREDOS E DICAS!,parcial
mqM_rWk-Xb4,Sausage Pasta | Gennaro Contaldo | Italian Special,parcial
gGElJBMTmHU,Pão italiano artesanal sem sovar | Padeiro de Apartamento,parcial
OZqlH5uKrZ8,Pipoca Doce de Chocolate Super Crocante e sem Pipoqueira,parcial
ietBN8Btcio,Decadent Chocolate Tiramisu Recipe in 10 Minutes,sem-desc
RFrx3FCiVws,French fries sauce #viralvideo #shortvideo #trending #sauce #fries,sem-desc
elpFvZWvTZc,How to Fix Beard Flyaways (at home),sem-desc
aWeHckhduso,Burrata Caprese Sandwich with Cherry Tomato Confit,sem-desc
-S5ufaw6L1s,CHOCOLATE Tiramisù ,sem-desc
RdNSjDbmCuk,Best Workbench for Tiny Workshops,sem-desc
VSPa8C2WYTw,[DRAGON BALL] 40th Anniversary Special Video,sem-desc
3zUFw_wDweI,RECEITA: Éclair de Natal,sem-desc
d2mKrCZkzOw,Esse você vai querer fazer sempre | Léo Abreu,sem-desc
XL76o9EPLR4,ALINE JABBOUR l Cozinhando com o Chefe,sem-desc
fMTW8knS7iw,I’m fascinated by these gravity hangers! #woodprojects #woodscraft #woodworking,sem-desc
vI7nHqrgN7Q,O QUE HÁ DE PIOR POR TRÁS DO CASO CARLA ZAMBELLI,sem-desc
8az1DVbQFhw,Como fazer pudim - Entendendo a lógica do pudim,sem-desc
oEkDfUwEaO8,Dica pra você que tem a janela exposta! #shorts,sem-desc
O96a8NpD1_M,Pão Italiano Caseiro da Rita Lobo,sem-desc
OtkKNk1hSJs,How to Find Your Next Favorite Podcast (Arielle Nissenblatt x Pocket Casts),sem-desc
e82uV9sBt4I,Stargate Announcement | Prime Video,sem-desc
T3wCcBaIi1c,Cycles,sem-desc
NNNlzfc5Pms,Hausgemachter Schinken in nur 10 Minuten! Dieser Trick wird Sie überraschen!,sem-desc
TJc2po9wNfc,감자 2개?! 감자튀김보다 맛있다! 놀라운 감자 요리!! 겉은 더 바삭하게 속은 더 부드럽게!,sem-desc
mHIe9VSikbA,1 Month in 10 Minutes! This Skillful Man Build a Workbench With 20 Functions,sem-desc
LqJFx6aMO2Q,양념치킨? 닭강정? 아님 둘 다? 닭가슴살로 만든 완벽한 양념치킨 : 120만 뷰 : 서진이네 보다 더 맛있다!,sem-desc
CG1Yzk_F0P8,How Italians Make Real Spaghetti Carbonara,sem-desc
nu2qwU1gP8Q,The Journey,sem-desc
7o4i_j7dLuE,This Green Sauce Makes Everything Better,sem-desc
TuQImukbnRg,Hacking the Pixmob LED bracelet (As used on Taylor Swifts Eras Tour),sem-desc
mMGZzC2GYDY,Guia US OPEN DE TÊNIS em Nova York 2025: dicas para aproveitar,sem-desc
NYonbq7-jfc,Potato-Crust Mediterranean Quiche – No Pastry Needed,sem-desc
felbqHTwStY,The French Onion Pasta You’ve Been Missing!,sem-desc
ud-YEYv6_VY,Pasta de Ricota apenas 5 min! #Shorts,sem-desc
RooEdtq_Lfo,How To Make Chicken Shawarma At Home,sem-desc
EDybk_t7eKE,How To Make The Perfect Grilled Cheese,sem-desc
l1Q-zzCgCwY,The Best Lasagna You'll Ever Make,sem-desc
77B_GLBhXGs,How To Make The Perfect Chocolate Chip Cookie,sem-desc
E4Qg8XFfvcY,The Best Spaghetti & Meatballs You’ll Ever Make,sem-desc
AJbJYwEduso,How To Make The Best Fried Chicken,sem-desc
nhScpa_fGZw,Hero Tortoise Rushes To Save Struggling Friend,sem-desc
nY2IcLEedxk,I stopped food waste (with engineering),sem-desc
HFsPi_CvzOU,Sudah lama mencari resep ini.Tanpa Coklat Batang DCC Tanpa Mentega! Brownies fudgy shiny crust mudah,sem-desc
pBTitN0y-YE,ULTIMATE Chocolate Tiramisu,sem-desc
e9hnjRfde2g,맛보장 에그푸딩! (걱정말고 이 레시피로 정착 하세요  완벽한 커스터드 푸딩  Egg Pudding  custard pudding  homemade dessert),sem-desc
hmYsi_NQ4dU,BATMAN me fez emagrecer 42kg (Falo tudo!) | Fala PH,sem-desc
R0Fxd13ogUg,Crispy Orange Chicken (Better Than Takeout),sem-desc
6FvqOoJhtFk,BRING ME TO LIFE COVER BY @bobbyamaru @Evanescence (Official Cover Video),sem-desc
8rjo63-0NNY,The History of STARGATE SG-1,sem-desc
9H_WboflUXo,OSCAR 2025 - AO VIVO | Comentários  transmissão  vencedores,sem-desc
tWjgYRWxbAw,Готовлю два раза в день и просят еще! Нереально вкусно!,sem-desc
y1GCIwLm3is,Project MINI RACK - a Homelab Revolution!,sem-desc
jL5SfJkEQLk,SISTEMA DE PUERTAS PLEGABLES CY-3124,sem-desc
q5z4caUrhoA,IDEIA GENIAL PARA UM PORTÃO AUTOMÁTICO - Ideia que Realmente Funciona,sem-desc
CMlnXx8ZoHA,Quanto gastei em um ano com o BYD Dolphin e 31 mil km! Carro elétrico compensa?,sem-desc
Yy27x_Vyb7w,Mesa com Regulagem de Altura Elétrica | Comfy ErgoLift Pro em L,sem-desc
