videoId,titulo,bucket
Zm4QJaWfDCs,19/10 | 15h00 | Bacurau  um rosto sem memória | Episódio 1: A invenção do Bacurau,sem-desc
gdtToNvWtl0,26/10 | 15h00 | Bacurau  um rosto sem memória | Episódio 2: O avesso,sem-desc
ix_TGUakvXs,Simply Chocolate Tiramisu l Jamie: Fast and Simple l Channel 4  Mondays  8pm,sem-desc
LoOl2enPw94,Série especial sobre o 11 de Setembro Compilada #EpisódioExtra,sem-desc
K8fKKMFyQpE,SmartThings | Casa Inteligente é isso isso isso,sem-desc
8nbcoklGPE8,O Balde de Pipoca de #AlienRomulus é de OUTRO MUNDO,sem-desc
o2y8bvOHpto,VRAU CAST: PR. HENRIQUE VIEIRA,sem-desc
ZHkoAWs-BQk,This hat has a secret function...,sem-desc
-tulfE90zzQ,11 GENIUS backpacks for international travel (#5 is my fav),sem-desc
lk26V7Kzc5I,Aer Travel Pack 3 Review and Walkthrough After Two Weeks in Japan,sem-desc
uAUALlGJ4lE,Aer Travel Pack 3 Vs Aer Travel Pack 3 Small Comparison,sem-desc
lPMl4sMBcCY,SUMMER 80s - LEJ,sem-desc
m1IrZZRN-Fk,PIB X REALIDADE  X QUALIDADE DE VIDA - Pan Cortes,sem-desc
ffnOVAIuemo,Crie um Servidor pra sua Casa hoje mesmo! (Modo EXTRA FÁCIL),sem-desc
pDIv5khkb84,O fim da mídia Física - O último a sair apague a luz!,sem-desc
o1OfdvhhWHY,As Tekbond não são todas iguais  veja as diferenças e evite comprar errado.,sem-desc
cMypDcXChTg,🔴 LIVE 13/12 - ÚLTIMAS NOVIDADES DE 2023,sem-desc
n8ByKmUoI_k,Setup dos sonhos e como eu liguei 2 monitores no macbook air M1,sem-desc
Tt1bJkpWl_g,O "BELISCO" PERFEITO PRA UMA REUNIÃO ENTRE AMIGOS!,sem-desc
XbAfLcGwXro,UM JEITO DIFERENTE DE SERVIR MACARRÃO!!,sem-desc
gVuQYlcydbE,CAFÉ DA MANHÃ SAUDÁVEL E PRÁTICO!,sem-desc
7cXbR1rlxfc,VALE A PENA? BLACK&DECKER MATRIX 6 EM 1 KIT COM 6 FERRAMENTAS COMBINADAS 20V QUICK CONNECT MTX20K6A,sem-desc
gtyfWnPTyiY,UM ANO FORA DA TV... E TUDO ÓTIMO 😉,sem-desc
IQc9rjW42rM,how to make a superbox from pvc |#toponemaker,sem-desc
e0A5xUpjBiA,UM CLÁSSICO FRANCÊS: TARTE TATIN,sem-desc
q9eVOrdJqnI,3 TIPOS DE MARINADAS PARA FRANGO!,sem-desc
fCHNyYVKFl8,RECEITA com BATATA SIMPLES DE FAZER  CLÁSSICA ESPANHOLA! (COM UM TOQUE NOSSO),sem-desc
oEuqT-Luqz8,Make a Aeroplane out of Ice-cream Sticks  | Piper m600 | #aeroplane #miniature,sem-desc
KGEbPKsu-KI,como abrir balança inteligente da xiaomi,sem-desc
A17bw1wLMSs,Mouthwatering BBQ Ribs Recipe | Master the Art of Finger-Licking Goodness!,sem-desc
T9uDOZ6INvU,A esfirra de carne mais rápida da Internet! | Léo Abreu,sem-desc
GE50FsmVIs0,ANTERO GRECO VOLTOU AOS ESTÚDIOS DA ESPN PARA O SPORTSCENTER E FEZ DISCURSO EMOCIONANTE; VEJA AQUI,sem-desc
_33iPic6D9I,A MELHOR FAROFA DE CASA DO DIA A DIA! #farofa #shorts #mandioca,sem-desc
7QfAo0OgT7o,Macarrão à bolonhesa com carne de porco? Vem aprender! | Léo Abreu,sem-desc
XpVRgyWxaqI,How to build a Desk  space saving an functional,sem-desc
HSm-4kCs3I4,Succession | Inside the Episode: Season 4  Episode 3 | Max,sem-desc
FCskcZChXYM,Salgado rápido e gostoso feito na Airfryer | Léo Abreu,sem-desc
2ryFSGM52OQ,Sanduíche natural de atum fácil e rápido! | Léo Abreu,sem-desc
OV6AvIpw9S0,Chico Bento | Vídeo Revelação - Isaac Amendoim como Chico Bento,sem-desc
pl-pdmw9h6U,5 quadrinhos indispensáveis | Vai Lendo 01,sem-desc
pXShkEU_z6k,Esse Frango à Parmegiana é bom demais! | Léo Abreu,sem-desc
9UMIVfx-YdI,Petisco fácil para o natal: Queijo Cremoso! | Léo Abreu,sem-desc
24EtYy8BbXs,COMO FAZER O MELHOR PUDIM DA TUA VIDA  de PAÇOCA! 🍮,sem-desc
5-0nYT97XZk,O URSO: Caos Perfeito | Crítica - 1a Temporada (The Bear),sem-desc
PisNnMa3qRY,O MELHOR E MAIS FÁCIL MOLHO BARBECUE,sem-desc
IH8gPgsmpKc,IN-N-OUT DOUBLE DOUBLE WITH ANIMAL FRIES FROM SCRATCH  I  Side of Salt with Salt Hank S2 E2,sem-desc
IGnNx4QKwR0,IN-N-OUT ANIMAL FRIES FROM SCRATCH #shorts,sem-desc
xnq8ICpDZI8,Taylor Swift’s favourite Chicken Fajitas!,sem-desc
20t5Q-nokyw,Alfajores Argentinos - Receitas Nestlé,sem-desc
I7okYp-UK98,Secrets ideas of Handyman,sem-desc
1C-zBcLRgSg,Everyone Should Learn to Cook a Burrito de Pollo y Frijoles,sem-desc
f-boUrDxrTI,Chocolate Party Cake | Jamie Oliver | ONE,sem-desc
5lYjfXxc6xc,Cook the Perfect Potato Pizza Tonight | Pizza Week,sem-desc
TNnAeQlJmf0,HOUSE OF THE DRAGON EP. 1x02 - Que comecem os jogos!,sem-desc
4eTJX0g2Bwo,Speedy Flatbreads | Jamie Oliver | ONE | Monday 8.30pm Channel 4 UK,sem-desc
C0Czgal7yk4,FAROFA OVO PERFEITA! SIMPLES  CROCANTE  E SABOROSA!,sem-desc
jo1R3Kwjkh8,Brownie Points for Everyone #ASMR,sem-desc
Aqc9mcVKgo4,완벽한 바삭!! 마늘 치즈 감자!! 겉바속촉 정말 맛있어요. 튀기지 않아요,sem-desc
boDmh30X9FQ,BATATA COM ALHO  MANTEIGA E ERVAS!,sem-desc
6l8QluLVRvw,STEP STOOL - made by WOOD Girl,sem-desc
DrB1-iu0bcc,O MELHOR ARROZ DOCE DO MUNDO!,sem-desc
QehqE4LNDG8,TMNT: The Last Ronin Animation,sem-desc
i67PDbhK8Gs,For All Mankind — The Science Behind Season 3: Episode 4  Happy Valley | Apple TV,sem-desc
C7q_MHLigkE,Buffalo Style Chicken Wings | Jamie Oliver,sem-desc
Fr6ydEiM-A4,The Chicken Parm Sandwich Done Right,sem-desc
qBp2XTn53o8,The Longest Yard: Rams Stop Titans Short of the Goal Line in Super Bowl XXXIV,sem-desc
N_nSU6_l3UA,APERTURE FOR BEGINNERS - Back to basics with Photo Genius.,sem-desc
VosF3lwnXEU,🪚 PINADOR PNEUMÁTICO MTX - SERÁ QUE FUNCIONA COM COMPRESSOR PEQUENO?,sem-desc
bVaN4bip5Eg,🪚 INCRIVEL IDÉIA COM MADEIRA DE PINUS / projeto simples para iniciante na marcenaria,sem-desc
tM1r-l1QJjE,Como fazer “Frango frito à coreana”com ingredientes de casa!,sem-desc
8JHoIezaF00,O SEGREDO DE MILHÕES DAQUELA MC LANCHONETE,sem-desc
fEakGqFk18A,슈퍼 바삭!! 감자 3개가 있으면 꼭 이 요리를 해보세요! 정말 맛있어요!,sem-desc
mF1wLDDhEaY,Easy & Delicious Salmon in Creamy Sun-Dried Tomato Sauce,sem-desc
mO6d-6A-rIg,BOLO DE CHOCOLATE CREMOSO!,sem-desc
k8ucaZL0tag,MACARRÃO À CARBONARA SEM ERRO! | com FELIPE CASTANHO,sem-desc
Nt4EYHhZ42E,História de Rapa Nui  a ilha de Páscoa | Nerdologia,sem-desc
b6n4GQSzr_0,TEA TABLE - made by WOOD Girl,sem-desc
Yrmh4KgbSWo,SUPER LOTES COM RARIDADES EM VHS (06/04/22),sem-desc
uUWTIeCIMco,Macarrão ao pesto amazônico,sem-desc
L0T-V6hUExs,O MELHOR PUDIM DE LEITE DA MINHA VIDA! Sem segredos! | com Gisela Queiroz,sem-desc
4CmS0zq6wjg,FARINHA PANKO! O QUE É? COMO SE FAZ?!,sem-desc
fKJP7RpfCG0,Dialing from Stargate to Stargate,sem-desc
t5QDQHZFd2w,Não faça macarrão antes de ver essa receita | Rigatoni All'arrabiata | Léo Abreu,sem-desc
iS7erzjc0RU,COMO FAZER TARÊ  #shorts,sem-desc
5HFSp78NFq4,CRISPY CHEESE MASALA TOAST - EPIC,sem-desc
-PFr7DkvMGM,$7 DIY Floating Wood Shelf – Easy and Affordable Build,sem-desc
0B1LuAJUmM4,How to make a simple hard drive holder - Off the Cuff - Wacky Wood Works.,sem-desc
d0cHmaonJxA,Hard Drive Little Shelf,sem-desc
1COJdS8qbuU,COMO FAZER BATATA PALHA CASEIRA | Léo Abreu,sem-desc
hUdnzTdWtxQ,DECABRÓN. Panhoca te ensina a fazer o brisket perfeito.,sem-desc
BD1lq5cL7sE,Tulipas de frango inesquecíveis! Panhoca te ensina a fazer as famosas Buffalo Wings com nosso dryrub,sem-desc
uKg-XN9JjSM,OVOS NO PURGATÓRIO!,sem-desc
2fDneQjeyKw,Molho de Tomate por Alex Atala,sem-desc
4yOQeZ4hpc4,A Lasanha de Carmela | Receita Soprano | HBO Brasil,sem-desc
y888FhaZiJM,A MELHOR SOBREMESA NATALINA! BABKA COM SORVETE!,sem-desc
R5-T42cjGww,TORTA CREMOSA DE CHOCOLATE LACTA INTENSE | Léo Abreu,sem-desc
0XTNs9qM8_M,Irmão do Jorel na HBO Max,sem-desc
mk3P1zYkvQM,Irmão do Jorel | Curta Exclusivo | HBO Max,sem-desc
crg7DPJNY80,O NOVO OMELETE ESTÁ ON: CONHEÇA NOSSA NOVA CASA! #NovoOmelete,sem-desc
S7euJVKMBB4,Wenn Sie 3 Kartoffeln und 3 Eier haben  machen Sie dieses köstliche Abendessen! ASMR,sem-desc
1Qz0j7E5vjY,11 Best BBQ Recipes | It's Time To Fire Up The Grill!,sem-desc
KYo0XYuKhsc,🔥 TUPIA de BANCADA mais FÁCIL e BARATA do Youtube - router table,sem-desc
Sm_tNxv1urk,UM CONVITE SURPRESA. VAI COMEÇAR.,sem-desc
NUSbG-xAH6g,3 RECEITAS DE SOPA: veja como fazer sopa de milho  tomate e grão-de-bico,sem-desc
Sy9He1QOyX0,SARGENTO CASEIRO FACIL DE FAZER | como fazer um sargento caseiro,sem-desc
Arq213QnC1Q,SEU JORGE: DE MORADOR DE RUA A ASTRO DE HOLLYWOOD | Retrato,sem-desc
oyh3jYKZ0E8,How to Make Homemade Pesto | Jamie Oliver,sem-desc
osocBbrLSfA,COMO FUNCIONA A RELAÇÃO AMAZON x CATARSE?,sem-desc
kk9kJnJNzWo,Sausage Wrap | Jamie Oliver,sem-desc
oxGjY-XSalI,Psycho for 8 Cellos,sem-desc
vNavk4v4_Ys,BIFE À PARMEGIANA | Amador x Profissional com Renata Vanzetto | Mohamad Hindi,sem-desc
se-A6ZycQWk,Todo Mundo Quase Morto [Blu-ray + DVD],sem-desc
22GYJrtnnvk,RÁPIDO E FÁCIL l Bruschetta Caprese l Leo Abreu,sem-desc
1FzbOxjUZQ8,Best Air-Fried Spicy Chicken Sandwich,sem-desc
4Hk6cAl4X7A,Tripod Tips - Photography Essentials with Photo Genius,sem-desc
0iXPPDDVpB0,Misture Leite Condensado na Maizena e Ficará Surpreso com o Resultado!,sem-desc
d3sdpcaMbPk,[오븐없이!] 화덕에 구운 것 같은 감자치즈빵! (후라이팬으로 맛있는 빵 만들기  Potato Cheese Bread),sem-desc
-E_O2PwZpCc,Crispy French Fries & Cheese Sauce,sem-desc
gDL85-7Pras,Setembro Amarelo,sem-desc
bFg3ljZF2kA,goodbye final space,sem-desc
ela3OrFCgUE,🪚 ACABAMENTO E QUALIDADE  FANTÁSTICA | Tingidores para madeira FARBEN,sem-desc
sOEZp3dh0jw,BOLSONARO DEVERIA RENUNCIAR,sem-desc
arjpleZCbFY,Will Smith Reveals Casting of Will for Bel-Air | Peacock Originals,sem-desc
7FA21yGkl1o,Crowd-Pleasing Texas Tacos de Suadero,sem-desc
xhHZ6vQWYVY,How to make Doritos Fried Chicken 😍  #shorts,sem-desc
Iu_nkcz994Y,QUEIJO EMPANADO (MOZZARELLA STICKS) | Leo Abreu,sem-desc
Yf8MZ8BfXFg,Nonna's Meatballs  Reimagined,sem-desc
voNCRUH9IAo,회오리 오므라이스 - 평택 후레쉬빌 / omelette rice - korean street food,sem-desc
jA3vLca7x1A,MACARRÃO DE COMITIVA | Dia dos Pais | Léo Abreu,sem-desc
jNsem58ddWw,🪚 VOCÊ PODE GANHAR ESSA PARAFUSADEIRA VONDER  | Veja como participar,sem-desc
TqIJrVXpAJA,Dig Into These Tuna Poke Wonton Nachos,sem-desc
aFx3O-Ku8kc,[CHOQUE DE CULTURA] DANIEL FURLAN - Flow Podcast #422,sem-desc
7tOH7u8gAnU,POLENTA COM RAGÚ DE COSTELA | Temporada de inverno | Léo Abreu,sem-desc
HrpL390aak0,The secret to fluffy omelettes is...,sem-desc
gr1dgD74nek,Mais que 8 Minutos #068 (Maria Bopp),sem-desc
L2KEf6LHgqc,🪚 BOSCH GTS 254 APÓS VER ESSE VÍDEO VAI QUERER COMPRAR A SUA | serra circular bosch gts254,sem-desc
0CoynDzFCcs,The Perfect Grilled Chimmichuri Chicken Wings 🤤,sem-desc
1E9gAWSxjx4,SUDESTINO,sem-desc
TWgihDdrKcA,ARROZ DOCE COM COCO | Leo Abreu,sem-desc
HlPqsGmEvGg,LOKI Ep. 06 - Final insosso,sem-desc
G3hYLrBzbBE,🔴 LIVE 14/7 NOVIDADES OP - Com a Participação Especial de Colecionadores da Comunidade!,sem-desc
LCVBkDMWHzI,A IMPORTÂNCIA DOS ANIMES NAS OLIMPÍADAS DO JAPÃO | Bentô,sem-desc
w3ae0onTwU0,MACARRÃO COM RAGU DE COSTELA BOVINA E QUEIJO | Mohamad Hindi | Receitas de Inverno,sem-desc
oKZgyr22VyY,Unique Idea From Broken Lifting Jack!,sem-desc
-oJLJhTQUZ4,Ted Lasso — The Lasso Way | Apple TV,sem-desc
Lx8X4UUM3vk,BOLO MOUSSE DE CHOCOLATE CREMOSO | Mohamad Hindi | Receitas de Inverno,sem-desc
rCthC55FpQU,PAVÊ COM CAFÉ - Léo Abreu,sem-desc
Sy3Q78-qIJI,LASANHA | Amador vs Profissional com Antonio Maiolica | Mohamad Hindi,sem-desc
oFKeJfQHFF8,How To Make Fried Chicken  According to a Pro #shorts,sem-desc
xkXIyDigmGM,Griechische Rühreier. Jeder wird nach dem Rezept fragen! Schnelles  einfaches und leckeres Gericht,sem-desc
v8yk_-9vt6o,Traditionelles spanisches Omelett mit NUR 3 Zutaten! Jeder wird begeistert sein,sem-desc
I_6aMZwf9CU,How to Make Perfect Chicken Manchurian Every Time,sem-desc
xj23zdgXVDM,3 CORTES PRA FAZER SUCESSO NO CHURRASCO | Léo Abreu,sem-desc
JPL2JbKj37k,Como fazer uma Luminária Urbana em Casa! - Luz  Decor & Ação!,sem-desc
NbSwyPUFTjI,Cebola Frita Crocante na AirFryer - Crispy - Fritadeira Sem Óleo,sem-desc
_X7HbuTJy4E,Minimalist Photography - Photo Genius photo challenge #22,sem-desc
lKoPPh6JHj0,🔴 LIVE #44 | PREÇOS MONSTRUOSOS!,sem-desc
C0GX4qcCuV0,DADINHO DE TAPIOCA!,sem-desc
Q2b-B2Rmzis,7 fairly uninteresting projects I've built,sem-desc
CJihyF5Q79g,A brilliant idea from an old fire extinguisher! You'll be glad to see it!,sem-desc
zUz5sYnA75o,Quick & Easy Ricotta-Stuffed Ravioli,sem-desc
vTEi5FFxMuE,Bolognese | Basics with Babish,sem-desc
zWuWrdaYMlY,Binging with Babish: Calzones from Seinfeld,sem-desc
IDkkKGp9kOg,LIVE 3 & OUT - Edição 002 - Cairo Santos,sem-desc
7T42LbojMTM,AR-CONDICIONADO INDIANO: Funciona mesmo?,sem-desc
H3qvgtaqDcM,LIVE 3 & OUT - Edição 001 - Ivan Zimmermann,sem-desc
ZC5IV_iRMXY,Novidades Obras-Primas do Cinema!,sem-desc
13Qqv3VU3uI,Chocolate Mousse with an Avocado Twist! #shorts,sem-desc
0St18jfyTRw,🔴 LIVE #38 | O OSCAR NAS NOSSAS COLEÇÕES,sem-desc
B6MKFAtqNKc,The Only Spaghetti & Meatballs Recipe You'll Need,sem-desc
AwOoMG3J4h8,Latkes | Basics with Babish,sem-desc
KUu2gJn1dzc,How to Make New-York-Style Pizza - TMNT II: Secret of the Ooze,sem-desc
kDdUdvNQndo,Brownies | Basics with Babish,sem-desc
jBnWZijMbMY,Binging with Babish: Garlic Bread from Scott Pilgrim vs The World,sem-desc
R4kwxiDlKzs,Potato Hash | Basics with Babish,sem-desc
6JFVKnrE_d8,Binging with Babish: Egg Sandwich from Birds of Prey,sem-desc
2uHhKAjnvNc,Binging with Babish: Freddy's Ribs from House of Cards,sem-desc
Enan6eEmtqM,Binging with Babish: Lemon Pepper Wet from Atlanta,sem-desc
_SObOsXrDRc,Pulled Pork | Basics with Babish,sem-desc
RKKKVybhxak,O CLÁSSICO DOS ANOS 90 | BATATA EM CONSERVA!,sem-desc
Zru1yk--rGQ,Binging with Babish - How to make a real Philly Cheesesteak from "Creed",sem-desc
dRLCZqEfJFA,Binging with Babish: Inferno Wing Challenge from Regular Show,sem-desc
RACzhMfHgOA,Emerald Hill Zone for 8 Cellos,sem-desc
MBSRPuUibxk,Gravitational Illusions,sem-desc
5mdktMXCnH8,Gordon's Guide To Bacon,sem-desc
q7JDYiLz9Mo,Binging with Babish: Croque Monsieur from Brooklyn Nine-Nine,sem-desc
ArQ567m3oVo,Chicken Piccata,sem-desc
nNcSFwZ_yu0,MEU SMASH BURGER PREFERIDO!,sem-desc
agpRL0YIkpo,How To Make Churros Like A Pro #shorts,sem-desc
JEuYtWRCU7E,COMO FAZER KETCHUP CASEIRO!,sem-desc
RZdzupvbjIg,ALHO E ÓLEO DIFERENTÃO!,sem-desc
gwKKojbIKdU,CASA INTELIGENTE' Instalando Motor de Persiana ZEMISMART WIFI e RF em uma Persiana manual.,sem-desc
HyTKGwD6RpQ,BATATA FRITA CROCANTE E SEQUINHA!,sem-desc
0hFTl64Ko6M,CROQUE MONSIEUR - O queridinho do brunch,sem-desc
vPY0ml9mN5o,This Isn't Your Mom's Macaroni and Cheese | Tastemade,sem-desc
IUaeHCLCTUw,Faça a ARMADILHA de PERNILONGOS que pega um MONTE!,sem-desc
8jZZSnRH_kU,The Perfect Souffle Pancake Recipe | Tastemade,sem-desc
TEWEM2M7TrY,COMO CORTAR CEBOLA | Cozinha Básica | Mohamad Hindi,sem-desc
T38LMV1mUbw,Grape Pizza!! | Keep Cooking Family Favourites | Jamie Oliver,sem-desc
I4JouOgtXOc,Receita de Molho Caçador (Jägersauce) e Molho de Pimentão (Paprikasauce) | Alemanizando,sem-desc
20UL2ZNDPl8,HAMBÚRGUER | Amador vs Profissional com Márcio Buzina | Mohamad Hindi,sem-desc
DvpIP-X95eM,Have you seen these little red discs?,sem-desc
tqoILOlHR54,MACARRONADA COM ALMÔNDEGAS | Leo Abreu,sem-desc
FOdUKvSOorw,Sucesso lá em casa! - Ovos mexidos bem molhadinhos,sem-desc
-BCwcr606g0,How a Movie Film Camera works in Slow Motion - The Slow Mo Guys,sem-desc
kaD2kBpWuV0,O BRASIL DEPOIS DA ABOLIÇÃO DA ESCRAVIDÃO - ft RAEL DA RIMA,sem-desc
1mJ9dRdhRVk,Petite Burger Recipe - The Best Superbowl Appetizer!,sem-desc
TG4dyHw2HM8,Macarrão com Pesto por Alex Atala,sem-desc
sv4H1eDqOu0,Espaguete Alho & Óleo por Alex Atala,sem-desc
dr8x7pWBIdU,Mario Kart for 8 Cellos,sem-desc
IV8Mz5OMsJY,Farofa de Alho por Alex Atala,sem-desc
RVTgLyYRc80,The Perfect Steak Fajitas & Shrimp Fajitas That Will Blow Your Family Away | Tastemade,sem-desc
5o0yzZPxNvI,CHORIPÁN - O SANDUÍCHE MAIS FAMOSO DA ARGENTINA - XEPA,sem-desc
EnIeONEcSGc,Kristian's Stargate Project,sem-desc
1Rf9-Ej2xPw,The Matrix | Never-Before-Seen Cold Open | Superfan Season 9 |  A Peacock Extra,sem-desc
LNGWS_fTxys,Batman for 8 Cellos,sem-desc
-cuW5q7dJ1A,8 Amazing Electrical Life Hacks | Tips & Tricks,sem-desc
owOive1VFLo,CHOQUE DE CULTURA #54: Tropa de Elite,sem-desc
t1Cznt_YZDk,1 mês usando e... Valeu a pena assinar o DISNEY PLUS?,sem-desc
b5sWusIXjRs,BROWNIES COM RUM PARA O NATAL!,sem-desc
pbk7O02nudo,Com HBO grátis por 5 anos  vale a pena assinar a DIRECTV GO?,sem-desc
wlOvJalBeYQ,Sonic 2 - Metropolis Zone Acapella,sem-desc
A8cMyR94O5Y,Animaniacs for 8 Cellos,sem-desc
EfHEulFdcZU,ORÁCULO MAC AND CHEESE DEFUMADO - XEPA!,sem-desc
r5kJ-NcS-6A,The Best Lemon Chicken And Chilli Chicken Recipe EVER • Taste Show,sem-desc
ENeX-R58G4E,Battle of the Planets for 10 Cellos,sem-desc
Ai2ANvomukY,É ASSIM QUE FAÇO MAIONESE! | ERICK JACQUIN,sem-desc
BT3QNhTJkMQ,100-Layer Lasagna,sem-desc
-aCJtxibSpA,100-Hour Lasagna,sem-desc
1ISgr-2qdK0,인터스텔라 Interstellar Main Theme "First Step" - Hans Zimmer / Marimba cover,sem-desc
0-GEmPZwVF0,A FELICIDADE NÃO SE COMPRA (It's a Wonderful Life) Blu-ray 4K - Coleção#01,sem-desc
i3Vqs3pm8jM,RECEITA CLÁSSICA DE BACALHAU | Brandade de bacalhau,sem-desc
nkcKdfL7G3A,Unboxing Spot The $75 000 Robot Dog,sem-desc
KZWCPUD9Wfw,Conhecendo e tirando dúvidas da nova central portão PPA POP com Freio !,sem-desc
QsNHTnY6HQg,Dungeons & Dragons Animated Series: Requiem The Final Episode.   AD FREE LINK IN DESCRIPTION,sem-desc
44F3BeYHxLQ,Working Stargate Mk2 from Glitch with Audio and Web Control,sem-desc
4jXSAxuhMxU,LOVECRAFT COUNTRY - Ep 09 - Lá e de volta outra vez,sem-desc
nztDjy3SxOs,Roda Viva | Luiz Henrique Mandetta | 12/10/2020,sem-desc
9NIfMSviJjU,🔴 A HORA DO COLECIONADOR 02 | ALISON BRITO,sem-desc
XtBrG6H1MjE,🔴 A HORA DO COLECIONADOR 01 | CARLOS POLI,sem-desc
TM6xnXXyyHM,BATATA ROSTI com Ovo e Bacon | Receita #96 TORRADA TORRADA,sem-desc
O8fQCN4Bink,🔴 A HORA DO COLECIONADOR (PILOTO) | PC_FOREVER,sem-desc
DE8z6a5OaoU,BIG NETO com molho especial! | Netão! Bom Beef #106,sem-desc
LR9DavLe9wc,Aprenda esta Técnica NINJA de Foco com Poluição Luminosa | #SpaceTips 041,sem-desc
nUU8XUhXo6g,Jurassic Park for 8 Cellos,sem-desc
8gM6WJ-ED9A,Por que o Brasil continuou um só e a América espanhola se dividiu após independência?,sem-desc
fADgUDtmrNw,Choripan do Netão! A melhor entradinha para o seu churrasco! | Netão! Bom Beef #34,sem-desc
cfpGzomuiAs,British Bolognese | Keep Cooking Family Favourites | Jamie Oliver,sem-desc
_9lBXzAc1Tk,X-Men: The Animated Series for 8 cellos,sem-desc
4--icNUqu3c,Special Scrambled Eggs | 7 Ways,sem-desc
0NbJIYwZ68c,How to Make Harley Quinn's Delicious Egg Sandwich From 'Birds of Prey',sem-desc
kdGdOYMnb5Q,POR QUE COLECIONAR? OU A IMPORTÂNCIA DE TER UMA COLEÇÃO (VINIL  CD  K7  DVD...),sem-desc
7zc8HNf6ETQ,Super Mario Bros for 3 Cellos... and egg shaker...,sem-desc
O6ZoHdFg_Bs,Duck Tales for 8 Cellos,sem-desc
8rjG1pUgtuE,La Sierra de Mesa 4 en 1  Que me Convirtió en NIVEL PRO!!💪,sem-desc
GvK1gVnfBHA,COMO FAZER CALDO DE CARNE E DEMI-GLACE | Técnicas,sem-desc
_bspJojod1k,RECEITA CASEIRA DO ORÁCULO BURGER - XEPA,sem-desc
tKZzgeqJb0Y,Thundercats for 8 cellos,sem-desc
VmM3EH5nrDg,Inspector Gadget for 8 cellos,sem-desc
nK-Vx8Sf-2E,Teenage Mutant Ninja Turtles for 10 cellos,sem-desc
73iTHJQaxcY,Airwolf for 8 Cellos,sem-desc
cvn8B1hm_Oo,Simple Lamb Stew | Quick and Easy Food | Jamie Oliver,sem-desc
yTIcV5EIqdM,Barbecue Hoisin Ribs | Jamie Oliver,sem-desc
Kf7VTgPCH8w,Unijovem | Passando pela Crise | 04/07/2020,sem-desc
xfZ4NIcRO-c,O MELHOR ESTROGONOFE DA MINHA VIDA! | ERICK JACQUIN,sem-desc
crdYIUdUOhc,It's Time to go BACK TO THE FUTURE! | Reunited Apart with Josh Gad,sem-desc
LgzudBvmd08,Binging with Babish: Nachos from The Good Place (plus Naco Redemption),sem-desc
IBm7Sya5YRU,OVO POCHE FÁCIL SEM ERRO! | VÍDEO CÁPSULA 01,sem-desc
aFLFujQNX9s,How to Make Korean Fried Chicken in 15 Minutes Recipe l Better Than Restaurants,sem-desc
GGXEB25WdyQ,John Boyega George Floyd protest London speech in full: Star Wars actor's powerful Hyde Park message,sem-desc
GK7GObLUCWU,How to make Jamie’s Lasagne | Jamie Oliver,sem-desc
LOrALdmPWVU,Dark – Temporada 3 | Anúncio de estreia | Netflix,sem-desc
uoHNzS9j3Is,POLPETONE SIMPLES E FÁCIL!,sem-desc
eYf595EJAc4,Knight Rider for 8 cellos,sem-desc
6UEnVZ3j6UA,CLASSICAL SOPRANO surprises audience with STAR TREK | Conductor Rainer Hersch,sem-desc
XNJ5HHNi7TQ,Mu tag & App Introduction,sem-desc
Fe9_4lKOOD4,Picanha Fatiada... é Picanha? I Churrasqueadas,sem-desc
qRkwSopXf-U,How To Make Cubanos with Homemade Cuban Bread,sem-desc
OSC_rRVaMC8,土豆新吃法，不用炸不用烤，孩子最喜欢了，咬一口满嘴拉丝！香！【阿胖面食】,sem-desc
5G0o9XWo9vM,Homemade Quesadillas | Keep Cooking & Carry On | Jamie Oliver #withme,sem-desc
M1B3gATS0GE,I built myself a proud parent machine,sem-desc
8Ytky9d9T8A,Torta Holandesa - Receitas Nestlé,sem-desc
HkXojFU_LrE,How to make Neapolitan Pizza Dough,sem-desc
oZFM2N0-DJE,Minha coleção de filmes | Parte 1 de 3,sem-desc
7ALMbZCkn4g,Minha coleção de filmes | Parte 2 de 3,sem-desc
IpXvsUMO6ww,Choripan de chimichurri com a Linguiça Toscana com Alho e Ervas Perdigão Na Brasa,sem-desc
Hkh9eZSqgKo,Ragù de Linguiça de "O Poderoso Chefão" | Comida de Cinema #39,sem-desc
CeNhbQ0RA6k,PAPRIKA SCHNITZEL (OU FILÉ DE PORCO À MILANESA  NÉ?) | Vualat,sem-desc
sRe079XdYVg,O SURF AND TURF DO MEU NOVO RESTAURANTE - 1985,sem-desc
ShZwA3ouaMA,MACARRÃO À CARBONARA DEFINITIVO! FÁCIL E SEM ERRO,sem-desc
AjEDvKFs_78,Making a paper shredder that looks like a brain,sem-desc
hzmpysD8Ql0,Gordon Ramsay's Salted Caramel Popcorn,sem-desc
BbF8R5--hjE,From ‘freak out’ to ‘thriving’ - the 3 stages of being a Wiser,sem-desc
xsmn-co5bVU,FRANGO FRITO SUPER CROCANTE! FÁCIL E RÁPIDO,sem-desc
ypvUNXWK1sk,Como fazer um DELICIOSO molho de tomate,sem-desc
DCTNlh-3hKw,Using 20 000 matches to make a coffee table,sem-desc
D3EHkOtAKME,Macarrão Alho e Óleo - COMIDAS FAVORITAS,sem-desc
xaw1Jk4PqJw,WRAP COM PEITO DE PERU | Origens com Rui Morschel,sem-desc
Vg-9qHCWdB0,Wonderful Places - A Year Well Travelled 2019,sem-desc
GdcCVZ_D7hQ,Garlic Soup Italian style with crispy croutons,sem-desc
nm4Ck6bD2_0,Sword of Omens (Thundercats) - MAN AT ARMS,sem-desc
oMdWoiCUQEI,Faroe Islands Travel Video - Finally Be Free [ZCAM E2 & Mavic 2 Pro],sem-desc
2gs4dsqZJE8,Aula 27 - Southern Fried Chicken (Frango Frito Americano) / Cansei de ser Chef,sem-desc
vGp2PeSBtNc,COMO FAZER MASSA FRESCA,sem-desc
H8Bc7zuQNwA,RAGU ESPECIAL DE 200K + VISITA A FÁBRICA DE CERVEJAS,sem-desc
Z6HG70shXKU,ANÁLISE DE STAR WARS: A ASCENSÃO SKYWALKER,sem-desc
6mvBf1ELxcw,Travel video shot on Sony Xperia 1 - Bali Indonesia 4K CinemaWide,sem-desc
wCm2DLhO5q0,Bolo de Rolo,sem-desc
e_icP_Y1dXY,APERITIVO INDISPENSÁVEL PARA SUA CEIA DE NATAL! | CEIA DE NATAL 2019,sem-desc
NqwW4BiLoBw,Honey Sesame Chicken | Everyday Gourmet S7 E12,sem-desc
iKQkczcj1Rs,One Pot Lasagne!,sem-desc
GojIHX38GMQ,The French Riviera - Côte d'Azur France - 4K Cinematic Travel Video,sem-desc
KkmNY5lM4GQ,Sobrecoxa de Frango com Chimichurri e Batata com Sour Cream do Netão! | Netão! Bom Beef #50,sem-desc
X5oD_thIk3c,How To Cook Perfect Eggs Every Time,sem-desc
0VQEJARHJ44,How to make... One Pan Pasta!,sem-desc
FsanXr238_k,Como fazer o melhor pão italiano!,sem-desc
6vebbDZxoKE,5 Min vs. 50 Min vs. 5 Hour Pasta (ft. Binging With Babish) • Tasty,sem-desc
ChzUN_RvMeY,Family Ragu with Gennaro Contaldo,sem-desc
1-SJGQ2HLp8,How to Make Perfect Pizza | Gennaro Contaldo,sem-desc
h5gcJjOSDv4,How To... cook steak  with Jamie Oliver's mate Pete,sem-desc
rbmsVTe-zkw,Tomato Relish l Tomato relish recipe,sem-desc
NHPhnFULXXs,Bifes de lombo de porco à manteiga de alecrim,sem-desc
APy5tsosXx4,Mykonos Greece From Drone Perspective  🇬🇷 DJI Mavic 2 pro,sem-desc
VpwtfwycNVo,Khoya Gulab jamun recipe | How to make gulab jamun,sem-desc
x64gbjmtnHM,Gennaro’s Family Lasagne,sem-desc
FVKcW78FtPk,RECEITA: O MELHOR MOUSSE DE CHOCOLATE DO MUNDO,sem-desc
-gF8d-fitkU,Easy Bolognese Recipe | Jamie Oliver,sem-desc
Yw-FSUEc8Pc,How To Make Chocolate Donuts | Gordon Ramsay,sem-desc
5Sa9nYKiYg0,The Original Orange Chicken by Panda Express,sem-desc
Il0z3nNRuC0,El Camino: A Breaking Bad Film | Teaser | Netflix,sem-desc
qJb2KPsOPVU,O MELHOR PETISCO DO MUNDO! | BOLINHOS DE BECHAMEL COM PRESUNTO E QUEIJO!,sem-desc
lWaBh-r2ZP0,3 Minute Tomato Pasta Sauce | Jamie Oliver & Davina McCall,sem-desc
0KpiuwhmCm4,Meatballs | Jamie Oliver | 20 Years of The Naked Chef,sem-desc
jd16yRTsP8k,20 FATOS SOBRE DARK  A SÉRIE ALEMÃ DO NETFLIX - Alemanizando,sem-desc
X6VtO8BDsQ8,COMO FAZER PÃO CASEIRO,sem-desc
umCKzvIaWwA,COMO FAZER BOLINHO DE ARROZ,sem-desc
mazRI6SUxX4,Detalhes de GAME OF THRONES 8x06 - O que foi escrito?,sem-desc
Hvw7K0s7xE8,COMO FAZER BRIGADEIRÃO,sem-desc
E4lv-od2_Ls,You'll Never Eat French Fries the Same Way Again 😮🍟 | Tastemade Staff Picks,sem-desc
rWJSk1i8sLY,COMO FAZER TORTA DE LIMÃO,sem-desc
CAs60fSOhw0,COMO FAZER CHEESECAKE COM CALDA DE GOIABADA,sem-desc
VtPf3aYaBNs,Game of Thrones Watch Party Recipes | The Hound's Fried Chicken,sem-desc
C_C2sUAc1tY,RECEITA DE ARROZ DE FORNO FÁCIL,sem-desc
HUvctvzhitg,COMO FAZER ESFIRRA DE CARNE,sem-desc
4L8AcrAYrEw,3 MELHORES DOCES COM PAÇOCA DA TASTEMADE,sem-desc
75iExVNvrWw,Kawhi Leonard Wins The Series At The Buzzer! | May 12  2019,sem-desc
1eYfW2tJK5Q,3 RECEITAS DA TASTEMADE COM MUITO QUEIJO,sem-desc
k72JxgIeWL0,COMO FAZER BOLO DE FUBÁ SUPER CREMOSO,sem-desc
NFa85dBx4C8,COMO FAZER BOLINHO DE CHUVA,sem-desc
QwLPjI_jMTo,Cacio E Pepe Pizza With Daniele Uditi | Like A Chef,sem-desc
FXk3VdQvTHw,COMO FAZER CHANTILLY EM CASA,sem-desc
cJZOfEOqKxM,RECEITA DE PUDIM DE LEITE CONDENSADO PERFEITO SEM FURINHOS,sem-desc
gf0qj6zPe-8,2 QUIBES DE FORNO,sem-desc
bqHAasBZETQ,3 MELHORES BOLINHOS DE CHUVA DA TASTEMADE,sem-desc
dBvsArke3L8,Austrian Fried Chicken I Backhendl - I´m from Austria #4 - Weber Master Touch GBS Premium Grill,sem-desc
iFrP6qdSFmc,CARBONARA | MINHA MASSA FAVORITA!,sem-desc
ABjTq6EMtzM,4 Easy Egg Recipes For Breakfast,sem-desc
8pGP-Ew7YOg,BATATA AO FORNO DA VOVÓ!,sem-desc
MSKLX8qFIjU,O MEU QUEIJO QUENTE PREFERIDO!,sem-desc
aEDYW5GfdXI,INFÂNCIA | AHAVAH (CLIPE OFICIAL),sem-desc
qYf3P1BvrzE,MOLHO PESTO SIMPLES E FÁCIL,sem-desc
