ietBN8Btcio	Decadent Chocolate Tiramisu Recipe in 10 Minutes
RFrx3FCiVws	French fries sauce #viralvideo #shortvideo #trending #sauce #fries
elpFvZWvTZc	How to Fix Beard Flyaways (at home)
aWeHckhduso	Burrata Caprese Sandwich with Cherry Tomato Confit
-S5ufaw6L1s	CHOCOLATE Tiramisù 
RdNSjDbmCuk	Best Workbench for Tiny Workshops
VSPa8C2WYTw	[DRAGON BALL] 40th Anniversary Special Video
3zUFw_wDweI	RECEITA: Éclair de Natal
d2mKrCZkzOw	Esse você vai querer fazer sempre | Léo Abreu
XL76o9EPLR4	ALINE JABBOUR l Cozinhando com o Chefe
fMTW8knS7iw	I’m fascinated by these gravity hangers! #woodprojects #woodscraft #woodworking
vI7nHqrgN7Q	O QUE HÁ DE PIOR POR TRÁS DO CASO CARLA ZAMBELLI
8az1DVbQFhw	Como fazer pudim - Entendendo a lógica do pudim
oEkDfUwEaO8	Dica pra você que tem a janela exposta! #shorts
O96a8NpD1_M	Pão Italiano Caseiro da Rita Lobo
OtkKNk1hSJs	How to Find Your Next Favorite Podcast (Arielle Nissenblatt x Pocket Casts)
e82uV9sBt4I	Stargate Announcement | Prime Video
T3wCcBaIi1c	Cycles
NNNlzfc5Pms	Hausgemachter Schinken in nur 10 Minuten! Dieser Trick wird Sie überraschen!
TJc2po9wNfc	감자 2개?! 감자튀김보다 맛있다! 놀라운 감자 요리!! 겉은 더 바삭하게 속은 더 부드럽게!
mHIe9VSikbA	1 Month in 10 Minutes! This Skillful Man Build a Workbench With 20 Functions
LqJFx6aMO2Q	양념치킨? 닭강정? 아님 둘 다? 닭가슴살로 만든 완벽한 양념치킨 : 120만 뷰 : 서진이네 보다 더 맛있다!
CG1Yzk_F0P8	How Italians Make Real Spaghetti Carbonara
nu2qwU1gP8Q	The Journey
7o4i_j7dLuE	This Green Sauce Makes Everything Better
TuQImukbnRg	Hacking the Pixmob LED bracelet (As used on Taylor Swifts Eras Tour)
mMGZzC2GYDY	Guia US OPEN DE TÊNIS em Nova York 2025: dicas para aproveitar
NYonbq7-jfc	Potato-Crust Mediterranean Quiche – No Pastry Needed
felbqHTwStY	The French Onion Pasta You’ve Been Missing!
ud-YEYv6_VY	Pasta de Ricota apenas 5 min! #Shorts
RooEdtq_Lfo	How To Make Chicken Shawarma At Home
EDybk_t7eKE	How To Make The Perfect Grilled Cheese
l1Q-zzCgCwY	The Best Lasagna You'll Ever Make
77B_GLBhXGs	How To Make The Perfect Chocolate Chip Cookie
E4Qg8XFfvcY	The Best Spaghetti & Meatballs You’ll Ever Make
AJbJYwEduso	How To Make The Best Fried Chicken
nhScpa_fGZw	Hero Tortoise Rushes To Save Struggling Friend
nY2IcLEedxk	I stopped food waste (with engineering)
HFsPi_CvzOU	Sudah lama mencari resep ini.Tanpa Coklat Batang DCC,Tanpa Mentega! Brownies fudgy shiny crust mudah
pBTitN0y-YE	ULTIMATE Chocolate Tiramisu
e9hnjRfde2g	맛보장 에그푸딩! (걱정말고 이 레시피로 정착 하세요, 완벽한 커스터드 푸딩, Egg Pudding, custard pudding, homemade dessert)
hmYsi_NQ4dU	BATMAN me fez emagrecer 42kg (Falo tudo!) | Fala PH
R0Fxd13ogUg	Crispy Orange Chicken (Better Than Takeout)
6FvqOoJhtFk	BRING ME TO LIFE COVER BY @bobbyamaru @Evanescence (Official Cover Video)
8rjo63-0NNY	The History of STARGATE SG-1
9H_WboflUXo	OSCAR 2025 - AO VIVO | Comentários, transmissão, vencedores
tWjgYRWxbAw	Готовлю два раза в день и просят еще! Нереально вкусно!
y1GCIwLm3is	Project MINI RACK - a Homelab Revolution!
jL5SfJkEQLk	SISTEMA DE PUERTAS PLEGABLES CY-3124
q5z4caUrhoA	IDEIA GENIAL PARA UM PORTÃO AUTOMÁTICO - Ideia que Realmente Funciona
CMlnXx8ZoHA	Quanto gastei em um ano com o BYD Dolphin e 31 mil km! Carro elétrico compensa?
Yy27x_Vyb7w	Mesa com Regulagem de Altura Elétrica | Comfy ErgoLift Pro em L
Zm4QJaWfDCs	19/10 | 15h00 | Bacurau, um rosto sem memória | Episódio 1: A invenção do Bacurau
gdtToNvWtl0	26/10 | 15h00 | Bacurau, um rosto sem memória | Episódio 2: O avesso
ix_TGUakvXs	Simply Chocolate Tiramisu l Jamie: Fast and Simple l Channel 4, Mondays, 8pm
LoOl2enPw94	Série especial sobre o 11 de Setembro Compilada #EpisódioExtra
K8fKKMFyQpE	SmartThings | Casa Inteligente é isso isso isso
8nbcoklGPE8	O Balde de Pipoca de #AlienRomulus é de OUTRO MUNDO
o2y8bvOHpto	VRAU CAST: PR. HENRIQUE VIEIRA
ZHkoAWs-BQk	This hat has a secret function...
-tulfE90zzQ	11 GENIUS backpacks for international travel (#5 is my fav)
lk26V7Kzc5I	Aer Travel Pack 3 Review and Walkthrough After Two Weeks in Japan
uAUALlGJ4lE	Aer Travel Pack 3 Vs Aer Travel Pack 3 Small Comparison
lPMl4sMBcCY	SUMMER 80s - LEJ
m1IrZZRN-Fk	PIB X REALIDADE  X QUALIDADE DE VIDA - Pan Cortes
ffnOVAIuemo	Crie um Servidor pra sua Casa hoje mesmo! (Modo EXTRA FÁCIL)
pDIv5khkb84	O fim da mídia Física - O último a sair apague a luz!
o1OfdvhhWHY	As Tekbond não são todas iguais, veja as diferenças e evite comprar errado.
cMypDcXChTg	🔴 LIVE 13/12 - ÚLTIMAS NOVIDADES DE 2023
n8ByKmUoI_k	Setup dos sonhos e como eu liguei 2 monitores no macbook air M1
Tt1bJkpWl_g	O "BELISCO" PERFEITO PRA UMA REUNIÃO ENTRE AMIGOS!
XbAfLcGwXro	UM JEITO DIFERENTE DE SERVIR MACARRÃO!!
gVuQYlcydbE	CAFÉ DA MANHÃ SAUDÁVEL E PRÁTICO!
7cXbR1rlxfc	VALE A PENA? BLACK&DECKER MATRIX 6 EM 1 KIT COM 6 FERRAMENTAS COMBINADAS 20V QUICK CONNECT MTX20K6A
gtyfWnPTyiY	UM ANO FORA DA TV... E TUDO ÓTIMO 😉
IQc9rjW42rM	how to make a superbox from pvc |#toponemaker
e0A5xUpjBiA	UM CLÁSSICO FRANCÊS: TARTE TATIN
q9eVOrdJqnI	3 TIPOS DE MARINADAS PARA FRANGO!
fCHNyYVKFl8	RECEITA com BATATA SIMPLES DE FAZER, CLÁSSICA ESPANHOLA! (COM UM TOQUE NOSSO)
oEuqT-Luqz8	Make a Aeroplane out of Ice-cream Sticks  | Piper m600 | #aeroplane #miniature
KGEbPKsu-KI	como abrir balança inteligente da xiaomi
A17bw1wLMSs	Mouthwatering BBQ Ribs Recipe | Master the Art of Finger-Licking Goodness!
T9uDOZ6INvU	A esfirra de carne mais rápida da Internet! | Léo Abreu
GE50FsmVIs0	ANTERO GRECO VOLTOU AOS ESTÚDIOS DA ESPN PARA O SPORTSCENTER E FEZ DISCURSO EMOCIONANTE; VEJA AQUI
_33iPic6D9I	A MELHOR FAROFA DE CASA DO DIA A DIA! #farofa #shorts #mandioca
7QfAo0OgT7o	Macarrão à bolonhesa com carne de porco? Vem aprender! | Léo Abreu
XpVRgyWxaqI	How to build a Desk, space saving an functional
HSm-4kCs3I4	Succession | Inside the Episode: Season 4, Episode 3 | Max
FCskcZChXYM	Salgado rápido e gostoso feito na Airfryer | Léo Abreu
2ryFSGM52OQ	Sanduíche natural de atum fácil e rápido! | Léo Abreu
OV6AvIpw9S0	Chico Bento | Vídeo Revelação - Isaac Amendoim como Chico Bento
pl-pdmw9h6U	5 quadrinhos indispensáveis | Vai Lendo 01
pXShkEU_z6k	Esse Frango à Parmegiana é bom demais! | Léo Abreu
9UMIVfx-YdI	Petisco fácil para o natal: Queijo Cremoso! | Léo Abreu
24EtYy8BbXs	COMO FAZER O MELHOR PUDIM DA TUA VIDA, de PAÇOCA! 🍮
5-0nYT97XZk	O URSO: Caos Perfeito | Crítica - 1a Temporada (The Bear)
PisNnMa3qRY	O MELHOR E MAIS FÁCIL MOLHO BARBECUE
IH8gPgsmpKc	IN-N-OUT DOUBLE DOUBLE WITH ANIMAL FRIES FROM SCRATCH  I  Side of Salt with Salt Hank S2 E2
IGnNx4QKwR0	IN-N-OUT ANIMAL FRIES FROM SCRATCH #shorts
xnq8ICpDZI8	Taylor Swift’s favourite Chicken Fajitas!
20t5Q-nokyw	Alfajores Argentinos - Receitas Nestlé
I7okYp-UK98	Secrets ideas of Handyman
1C-zBcLRgSg	Everyone Should Learn to Cook a Burrito de Pollo y Frijoles
f-boUrDxrTI	Chocolate Party Cake | Jamie Oliver | ONE
5lYjfXxc6xc	Cook the Perfect Potato Pizza Tonight | Pizza Week
TNnAeQlJmf0	HOUSE OF THE DRAGON EP. 1x02 - Que comecem os jogos!
4eTJX0g2Bwo	Speedy Flatbreads | Jamie Oliver | ONE | Monday 8.30pm Channel 4 UK
C0Czgal7yk4	FAROFA OVO PERFEITA! SIMPLES, CROCANTE, E SABOROSA!
jo1R3Kwjkh8	Brownie Points for Everyone #ASMR
Aqc9mcVKgo4	완벽한 바삭!! 마늘 치즈 감자!! 겉바속촉 정말 맛있어요. 튀기지 않아요
boDmh30X9FQ	BATATA COM ALHO, MANTEIGA E ERVAS!
6l8QluLVRvw	STEP STOOL - made by WOOD Girl
DrB1-iu0bcc	O MELHOR ARROZ DOCE DO MUNDO!
QehqE4LNDG8	TMNT: The Last Ronin Animation
i67PDbhK8Gs	For All Mankind — The Science Behind Season 3: Episode 4, Happy Valley | Apple TV
C7q_MHLigkE	Buffalo Style Chicken Wings | Jamie Oliver
Fr6ydEiM-A4	The Chicken Parm Sandwich Done Right
qBp2XTn53o8	The Longest Yard: Rams Stop Titans Short of the Goal Line in Super Bowl XXXIV
N_nSU6_l3UA	APERTURE FOR BEGINNERS - Back to basics with Photo Genius.
VosF3lwnXEU	🪚 PINADOR PNEUMÁTICO MTX - SERÁ QUE FUNCIONA COM COMPRESSOR PEQUENO?
bVaN4bip5Eg	🪚 INCRIVEL IDÉIA COM MADEIRA DE PINUS / projeto simples para iniciante na marcenaria
tM1r-l1QJjE	Como fazer “Frango frito à coreana”com ingredientes de casa!
8JHoIezaF00	O SEGREDO DE MILHÕES DAQUELA MC LANCHONETE
fEakGqFk18A	슈퍼 바삭!! 감자 3개가 있으면 꼭 이 요리를 해보세요! 정말 맛있어요!
mF1wLDDhEaY	Easy & Delicious Salmon in Creamy Sun-Dried Tomato Sauce
mO6d-6A-rIg	BOLO DE CHOCOLATE CREMOSO!
k8ucaZL0tag	MACARRÃO À CARBONARA SEM ERRO! | com FELIPE CASTANHO
Nt4EYHhZ42E	História de Rapa Nui, a ilha de Páscoa | Nerdologia
b6n4GQSzr_0	TEA TABLE - made by WOOD Girl
Yrmh4KgbSWo	SUPER LOTES COM RARIDADES EM VHS (06/04/22)
uUWTIeCIMco	Macarrão ao pesto amazônico
L0T-V6hUExs	O MELHOR PUDIM DE LEITE DA MINHA VIDA! Sem segredos! | com Gisela Queiroz
4CmS0zq6wjg	FARINHA PANKO! O QUE É? COMO SE FAZ?!
fKJP7RpfCG0	Dialing from Stargate to Stargate
t5QDQHZFd2w	Não faça macarrão antes de ver essa receita | Rigatoni All'arrabiata | Léo Abreu
iS7erzjc0RU	COMO FAZER TARÊ  #shorts
5HFSp78NFq4	CRISPY CHEESE MASALA TOAST - EPIC
-PFr7DkvMGM	$7 DIY Floating Wood Shelf – Easy and Affordable Build
0B1LuAJUmM4	How to make a simple hard drive holder - Off the Cuff - Wacky Wood Works.
d0cHmaonJxA	Hard Drive Little Shelf
1COJdS8qbuU	COMO FAZER BATATA PALHA CASEIRA | Léo Abreu
hUdnzTdWtxQ	DECABRÓN. Panhoca te ensina a fazer o brisket perfeito.
BD1lq5cL7sE	Tulipas de frango inesquecíveis! Panhoca te ensina a fazer as famosas Buffalo Wings com nosso dryrub
uKg-XN9JjSM	OVOS NO PURGATÓRIO!
2fDneQjeyKw	Molho de Tomate por Alex Atala
4yOQeZ4hpc4	A Lasanha de Carmela | Receita Soprano | HBO Brasil
y888FhaZiJM	A MELHOR SOBREMESA NATALINA! BABKA COM SORVETE!
R5-T42cjGww	TORTA CREMOSA DE CHOCOLATE LACTA INTENSE | Léo Abreu
0XTNs9qM8_M	Irmão do Jorel na HBO Max
mk3P1zYkvQM	Irmão do Jorel | Curta Exclusivo | HBO Max
crg7DPJNY80	O NOVO OMELETE ESTÁ ON: CONHEÇA NOSSA NOVA CASA! #NovoOmelete
S7euJVKMBB4	Wenn Sie 3 Kartoffeln und 3 Eier haben, machen Sie dieses köstliche Abendessen! ASMR
1Qz0j7E5vjY	11 Best BBQ Recipes | It's Time To Fire Up The Grill!
KYo0XYuKhsc	🔥 TUPIA de BANCADA mais FÁCIL e BARATA do Youtube - router table
Sm_tNxv1urk	UM CONVITE SURPRESA. VAI COMEÇAR.
NUSbG-xAH6g	3 RECEITAS DE SOPA: veja como fazer sopa de milho, tomate e grão-de-bico
Sy9He1QOyX0	SARGENTO CASEIRO FACIL DE FAZER | como fazer um sargento caseiro
Arq213QnC1Q	SEU JORGE: DE MORADOR DE RUA A ASTRO DE HOLLYWOOD | Retrato
oyh3jYKZ0E8	How to Make Homemade Pesto | Jamie Oliver
osocBbrLSfA	COMO FUNCIONA A RELAÇÃO AMAZON x CATARSE?
kk9kJnJNzWo	Sausage Wrap | Jamie Oliver
oxGjY-XSalI	Psycho for 8 Cellos
vNavk4v4_Ys	BIFE À PARMEGIANA | Amador x Profissional com Renata Vanzetto | Mohamad Hindi
se-A6ZycQWk	Todo Mundo Quase Morto [Blu-ray + DVD]
22GYJrtnnvk	RÁPIDO E FÁCIL l Bruschetta Caprese l Leo Abreu
1FzbOxjUZQ8	Best Air-Fried Spicy Chicken Sandwich
4Hk6cAl4X7A	Tripod Tips - Photography Essentials with Photo Genius
0iXPPDDVpB0	Misture Leite Condensado na Maizena e Ficará Surpreso com o Resultado!
d3sdpcaMbPk	[오븐없이!] 화덕에 구운 것 같은 감자치즈빵! (후라이팬으로 맛있는 빵 만들기, Potato Cheese Bread)
-E_O2PwZpCc	Crispy French Fries & Cheese Sauce
gDL85-7Pras	Setembro Amarelo
bFg3ljZF2kA	goodbye final space
ela3OrFCgUE	🪚 ACABAMENTO E QUALIDADE  FANTÁSTICA | Tingidores para madeira FARBEN
sOEZp3dh0jw	BOLSONARO DEVERIA RENUNCIAR
arjpleZCbFY	Will Smith Reveals Casting of Will for Bel-Air | Peacock Originals
7FA21yGkl1o	Crowd-Pleasing Texas Tacos de Suadero
xhHZ6vQWYVY	How to make Doritos Fried Chicken 😍  #shorts
Iu_nkcz994Y	QUEIJO EMPANADO (MOZZARELLA STICKS) | Leo Abreu
Yf8MZ8BfXFg	Nonna's Meatballs, Reimagined
voNCRUH9IAo	회오리 오므라이스 - 평택 후레쉬빌 / omelette rice - korean street food
jA3vLca7x1A	MACARRÃO DE COMITIVA | Dia dos Pais | Léo Abreu
jNsem58ddWw	🪚 VOCÊ PODE GANHAR ESSA PARAFUSADEIRA VONDER  | Veja como participar
TqIJrVXpAJA	Dig Into These Tuna Poke Wonton Nachos
aFx3O-Ku8kc	[CHOQUE DE CULTURA] DANIEL FURLAN - Flow Podcast #422
7tOH7u8gAnU	POLENTA COM RAGÚ DE COSTELA | Temporada de inverno | Léo Abreu
HrpL390aak0	The secret to fluffy omelettes is...
gr1dgD74nek	Mais que 8 Minutos #068 (Maria Bopp)
L2KEf6LHgqc	🪚 BOSCH GTS 254 APÓS VER ESSE VÍDEO VAI QUERER COMPRAR A SUA | serra circular bosch gts254
0CoynDzFCcs	The Perfect Grilled Chimmichuri Chicken Wings 🤤
1E9gAWSxjx4	SUDESTINO
TWgihDdrKcA	ARROZ DOCE COM COCO | Leo Abreu
HlPqsGmEvGg	LOKI Ep. 06 - Final insosso
G3hYLrBzbBE	🔴 LIVE 14/7 NOVIDADES OP - Com a Participação Especial de Colecionadores da Comunidade!
LCVBkDMWHzI	A IMPORTÂNCIA DOS ANIMES NAS OLIMPÍADAS DO JAPÃO | Bentô
w3ae0onTwU0	MACARRÃO COM RAGU DE COSTELA BOVINA E QUEIJO | Mohamad Hindi | Receitas de Inverno
oKZgyr22VyY	Unique Idea From Broken Lifting Jack!
-oJLJhTQUZ4	Ted Lasso — The Lasso Way | Apple TV
Lx8X4UUM3vk	BOLO MOUSSE DE CHOCOLATE CREMOSO | Mohamad Hindi | Receitas de Inverno
rCthC55FpQU	PAVÊ COM CAFÉ - Léo Abreu
Sy3Q78-qIJI	LASANHA | Amador vs Profissional com Antonio Maiolica | Mohamad Hindi
oFKeJfQHFF8	How To Make Fried Chicken, According to a Pro #shorts
xkXIyDigmGM	Griechische Rühreier. Jeder wird nach dem Rezept fragen! Schnelles, einfaches und leckeres Gericht
v8yk_-9vt6o	Traditionelles spanisches Omelett mit NUR 3 Zutaten! Jeder wird begeistert sein
I_6aMZwf9CU	How to Make Perfect Chicken Manchurian Every Time
xj23zdgXVDM	3 CORTES PRA FAZER SUCESSO NO CHURRASCO | Léo Abreu
JPL2JbKj37k	Como fazer uma Luminária Urbana em Casa! - Luz, Decor & Ação!
NbSwyPUFTjI	Cebola Frita Crocante na AirFryer - Crispy - Fritadeira Sem Óleo
_X7HbuTJy4E	Minimalist Photography - Photo Genius photo challenge #22
lKoPPh6JHj0	🔴 LIVE #44 | PREÇOS MONSTRUOSOS!
C0GX4qcCuV0	DADINHO DE TAPIOCA!
Q2b-B2Rmzis	7 fairly uninteresting projects I've built
CJihyF5Q79g	A brilliant idea from an old fire extinguisher! You'll be glad to see it!
zUz5sYnA75o	Quick & Easy Ricotta-Stuffed Ravioli
vTEi5FFxMuE	Bolognese | Basics with Babish
zWuWrdaYMlY	Binging with Babish: Calzones from Seinfeld
IDkkKGp9kOg	LIVE 3 & OUT - Edição 002 - Cairo Santos
7T42LbojMTM	AR-CONDICIONADO INDIANO: Funciona mesmo?
H3qvgtaqDcM	LIVE 3 & OUT - Edição 001 - Ivan Zimmermann
ZC5IV_iRMXY	Novidades Obras-Primas do Cinema!
13Qqv3VU3uI	Chocolate Mousse with an Avocado Twist! #shorts
0St18jfyTRw	🔴 LIVE #38 | O OSCAR NAS NOSSAS COLEÇÕES
B6MKFAtqNKc	The Only Spaghetti & Meatballs Recipe You'll Need
AwOoMG3J4h8	Latkes | Basics with Babish
KUu2gJn1dzc	How to Make New-York-Style Pizza - TMNT II: Secret of the Ooze
kDdUdvNQndo	Brownies | Basics with Babish
jBnWZijMbMY	Binging with Babish: Garlic Bread from Scott Pilgrim vs The World
R4kwxiDlKzs	Potato Hash | Basics with Babish
6JFVKnrE_d8	Binging with Babish: Egg Sandwich from Birds of Prey
2uHhKAjnvNc	Binging with Babish: Freddy's Ribs from House of Cards
Enan6eEmtqM	Binging with Babish: Lemon Pepper Wet from Atlanta
_SObOsXrDRc	Pulled Pork | Basics with Babish
RKKKVybhxak	O CLÁSSICO DOS ANOS 90 | BATATA EM CONSERVA!
Zru1yk--rGQ	Binging with Babish - How to make a real Philly Cheesesteak from "Creed"
dRLCZqEfJFA	Binging with Babish: Inferno Wing Challenge from Regular Show
RACzhMfHgOA	Emerald Hill Zone for 8 Cellos
MBSRPuUibxk	Gravitational Illusions
5mdktMXCnH8	Gordon's Guide To Bacon
q7JDYiLz9Mo	Binging with Babish: Croque Monsieur from Brooklyn Nine-Nine
ArQ567m3oVo	Chicken Piccata
nNcSFwZ_yu0	MEU SMASH BURGER PREFERIDO!
agpRL0YIkpo	How To Make Churros Like A Pro #shorts
JEuYtWRCU7E	COMO FAZER KETCHUP CASEIRO!
RZdzupvbjIg	ALHO E ÓLEO DIFERENTÃO!
gwKKojbIKdU	CASA INTELIGENTE' Instalando Motor de Persiana ZEMISMART WIFI e RF em uma Persiana manual.
HyTKGwD6RpQ	BATATA FRITA CROCANTE E SEQUINHA!
0hFTl64Ko6M	CROQUE MONSIEUR - O queridinho do brunch
vPY0ml9mN5o	This Isn't Your Mom's Macaroni and Cheese | Tastemade
IUaeHCLCTUw	Faça a ARMADILHA de PERNILONGOS que pega um MONTE!
8jZZSnRH_kU	The Perfect Souffle Pancake Recipe | Tastemade
TEWEM2M7TrY	COMO CORTAR CEBOLA | Cozinha Básica | Mohamad Hindi
T38LMV1mUbw	Grape Pizza!! | Keep Cooking Family Favourites | Jamie Oliver
I4JouOgtXOc	Receita de Molho Caçador (Jägersauce) e Molho de Pimentão (Paprikasauce) | Alemanizando
20UL2ZNDPl8	HAMBÚRGUER | Amador vs Profissional com Márcio Buzina | Mohamad Hindi
DvpIP-X95eM	Have you seen these little red discs?
tqoILOlHR54	MACARRONADA COM ALMÔNDEGAS | Leo Abreu
FOdUKvSOorw	Sucesso lá em casa! - Ovos mexidos bem molhadinhos
-BCwcr606g0	How a Movie Film Camera works in Slow Motion - The Slow Mo Guys
kaD2kBpWuV0	O BRASIL DEPOIS DA ABOLIÇÃO DA ESCRAVIDÃO - ft RAEL DA RIMA
1mJ9dRdhRVk	Petite Burger Recipe - The Best Superbowl Appetizer!
TG4dyHw2HM8	Macarrão com Pesto por Alex Atala
sv4H1eDqOu0	Espaguete Alho & Óleo por Alex Atala
dr8x7pWBIdU	Mario Kart for 8 Cellos
IV8Mz5OMsJY	Farofa de Alho por Alex Atala
RVTgLyYRc80	The Perfect Steak Fajitas & Shrimp Fajitas That Will Blow Your Family Away | Tastemade
5o0yzZPxNvI	CHORIPÁN - O SANDUÍCHE MAIS FAMOSO DA ARGENTINA - XEPA
EnIeONEcSGc	Kristian's Stargate Project
1Rf9-Ej2xPw	The Matrix | Never-Before-Seen Cold Open | Superfan Season 9 |  A Peacock Extra
LNGWS_fTxys	Batman for 8 Cellos
-cuW5q7dJ1A	8 Amazing Electrical Life Hacks | Tips & Tricks
owOive1VFLo	CHOQUE DE CULTURA #54: Tropa de Elite
t1Cznt_YZDk	1 mês usando e... Valeu a pena assinar o DISNEY PLUS?
b5sWusIXjRs	BROWNIES COM RUM PARA O NATAL!
pbk7O02nudo	Com HBO grátis por 5 anos, vale a pena assinar a DIRECTV GO?
wlOvJalBeYQ	Sonic 2 - Metropolis Zone Acapella
A8cMyR94O5Y	Animaniacs for 8 Cellos
EfHEulFdcZU	ORÁCULO MAC AND CHEESE DEFUMADO - XEPA!
r5kJ-NcS-6A	The Best Lemon Chicken And Chilli Chicken Recipe EVER • Taste Show
ENeX-R58G4E	Battle of the Planets for 10 Cellos
Ai2ANvomukY	É ASSIM QUE FAÇO MAIONESE! | ERICK JACQUIN
BT3QNhTJkMQ	100-Layer Lasagna
-aCJtxibSpA	100-Hour Lasagna
1ISgr-2qdK0	인터스텔라 Interstellar Main Theme "First Step" - Hans Zimmer / Marimba cover
0-GEmPZwVF0	A FELICIDADE NÃO SE COMPRA (It's a Wonderful Life) Blu-ray 4K - Coleção#01
i3Vqs3pm8jM	RECEITA CLÁSSICA DE BACALHAU | Brandade de bacalhau
nkcKdfL7G3A	Unboxing Spot The $75,000 Robot Dog
KZWCPUD9Wfw	Conhecendo e tirando dúvidas da nova central portão PPA POP com Freio !
QsNHTnY6HQg	Dungeons & Dragons Animated Series: Requiem The Final Episode.   AD FREE LINK IN DESCRIPTION
44F3BeYHxLQ	Working Stargate Mk2 from Glitch with Audio and Web Control
4jXSAxuhMxU	LOVECRAFT COUNTRY - Ep 09 - Lá e de volta outra vez
nztDjy3SxOs	Roda Viva | Luiz Henrique Mandetta | 12/10/2020
9NIfMSviJjU	🔴 A HORA DO COLECIONADOR 02 | ALISON BRITO
XtBrG6H1MjE	🔴 A HORA DO COLECIONADOR 01 | CARLOS POLI
TM6xnXXyyHM	BATATA ROSTI com Ovo e Bacon | Receita #96 TORRADA TORRADA
O8fQCN4Bink	🔴 A HORA DO COLECIONADOR (PILOTO) | PC_FOREVER
DE8z6a5OaoU	BIG NETO com molho especial! | Netão! Bom Beef #106
LR9DavLe9wc	Aprenda esta Técnica NINJA de Foco com Poluição Luminosa | #SpaceTips 041
nUU8XUhXo6g	Jurassic Park for 8 Cellos
8gM6WJ-ED9A	Por que o Brasil continuou um só e a América espanhola se dividiu após independência?
fADgUDtmrNw	Choripan do Netão! A melhor entradinha para o seu churrasco! | Netão! Bom Beef #34
cfpGzomuiAs	British Bolognese | Keep Cooking Family Favourites | Jamie Oliver
_9lBXzAc1Tk	X-Men: The Animated Series for 8 cellos
4--icNUqu3c	Special Scrambled Eggs | 7 Ways
0NbJIYwZ68c	How to Make Harley Quinn's Delicious Egg Sandwich From 'Birds of Prey'
kdGdOYMnb5Q	POR QUE COLECIONAR? OU A IMPORTÂNCIA DE TER UMA COLEÇÃO (VINIL, CD, K7, DVD...)
7zc8HNf6ETQ	Super Mario Bros for 3 Cellos... and egg shaker...
O6ZoHdFg_Bs	Duck Tales for 8 Cellos
8rjG1pUgtuE	La Sierra de Mesa 4 en 1, Que me Convirtió en NIVEL PRO!!💪
GvK1gVnfBHA	COMO FAZER CALDO DE CARNE E DEMI-GLACE | Técnicas
_bspJojod1k	RECEITA CASEIRA DO ORÁCULO BURGER - XEPA
tKZzgeqJb0Y	Thundercats for 8 cellos
VmM3EH5nrDg	Inspector Gadget for 8 cellos
nK-Vx8Sf-2E	Teenage Mutant Ninja Turtles for 10 cellos
73iTHJQaxcY	Airwolf for 8 Cellos
cvn8B1hm_Oo	Simple Lamb Stew | Quick and Easy Food | Jamie Oliver
yTIcV5EIqdM	Barbecue Hoisin Ribs | Jamie Oliver
Kf7VTgPCH8w	Unijovem | Passando pela Crise | 04/07/2020
xfZ4NIcRO-c	O MELHOR ESTROGONOFE DA MINHA VIDA! | ERICK JACQUIN
crdYIUdUOhc	It's Time to go BACK TO THE FUTURE! | Reunited Apart with Josh Gad
LgzudBvmd08	Binging with Babish: Nachos from The Good Place (plus Naco Redemption)
IBm7Sya5YRU	OVO POCHE FÁCIL SEM ERRO! | VÍDEO CÁPSULA 01
aFLFujQNX9s	How to Make Korean Fried Chicken in 15 Minutes Recipe l Better Than Restaurants
GGXEB25WdyQ	John Boyega George Floyd protest London speech in full: Star Wars actor's powerful Hyde Park message
GK7GObLUCWU	How to make Jamie’s Lasagne | Jamie Oliver
LOrALdmPWVU	Dark – Temporada 3 | Anúncio de estreia | Netflix
uoHNzS9j3Is	POLPETONE SIMPLES E FÁCIL!
eYf595EJAc4	Knight Rider for 8 cellos
6UEnVZ3j6UA	CLASSICAL SOPRANO surprises audience with STAR TREK | Conductor Rainer Hersch
XNJ5HHNi7TQ	Mu tag & App Introduction
Fe9_4lKOOD4	Picanha Fatiada... é Picanha? I Churrasqueadas
qRkwSopXf-U	How To Make Cubanos with Homemade Cuban Bread
OSC_rRVaMC8	土豆新吃法，不用炸不用烤，孩子最喜欢了，咬一口满嘴拉丝！香！【阿胖面食】
5G0o9XWo9vM	Homemade Quesadillas | Keep Cooking & Carry On | Jamie Oliver #withme
M1B3gATS0GE	I built myself a proud parent machine
8Ytky9d9T8A	Torta Holandesa - Receitas Nestlé
HkXojFU_LrE	How to make Neapolitan Pizza Dough
oZFM2N0-DJE	Minha coleção de filmes | Parte 1 de 3
7ALMbZCkn4g	Minha coleção de filmes | Parte 2 de 3
IpXvsUMO6ww	Choripan de chimichurri com a Linguiça Toscana com Alho e Ervas Perdigão Na Brasa
Hkh9eZSqgKo	Ragù de Linguiça de "O Poderoso Chefão" | Comida de Cinema #39
CeNhbQ0RA6k	PAPRIKA SCHNITZEL (OU FILÉ DE PORCO À MILANESA, NÉ?) | Vualat
sRe079XdYVg	O SURF AND TURF DO MEU NOVO RESTAURANTE - 1985
ShZwA3ouaMA	MACARRÃO À CARBONARA DEFINITIVO! FÁCIL E SEM ERRO
AjEDvKFs_78	Making a paper shredder that looks like a brain
hzmpysD8Ql0	Gordon Ramsay's Salted Caramel Popcorn
BbF8R5--hjE	From ‘freak out’ to ‘thriving’ - the 3 stages of being a Wiser
xsmn-co5bVU	FRANGO FRITO SUPER CROCANTE! FÁCIL E RÁPIDO
ypvUNXWK1sk	Como fazer um DELICIOSO molho de tomate
DCTNlh-3hKw	Using 20,000 matches to make a coffee table
D3EHkOtAKME	Macarrão Alho e Óleo - COMIDAS FAVORITAS
xaw1Jk4PqJw	WRAP COM PEITO DE PERU | Origens com Rui Morschel
Vg-9qHCWdB0	Wonderful Places - A Year Well Travelled 2019
GdcCVZ_D7hQ	Garlic Soup Italian style with crispy croutons
nm4Ck6bD2_0	Sword of Omens (Thundercats) - MAN AT ARMS
oMdWoiCUQEI	Faroe Islands Travel Video - Finally Be Free [ZCAM E2 & Mavic 2 Pro]
2gs4dsqZJE8	Aula 27 - Southern Fried Chicken (Frango Frito Americano) / Cansei de ser Chef
vGp2PeSBtNc	COMO FAZER MASSA FRESCA
H8Bc7zuQNwA	RAGU ESPECIAL DE 200K + VISITA A FÁBRICA DE CERVEJAS
Z6HG70shXKU	ANÁLISE DE STAR WARS: A ASCENSÃO SKYWALKER
6mvBf1ELxcw	Travel video shot on Sony Xperia 1 - Bali Indonesia 4K CinemaWide
wCm2DLhO5q0	Bolo de Rolo
e_icP_Y1dXY	APERITIVO INDISPENSÁVEL PARA SUA CEIA DE NATAL! | CEIA DE NATAL 2019
NqwW4BiLoBw	Honey Sesame Chicken | Everyday Gourmet S7 E12
iKQkczcj1Rs	One Pot Lasagne!
GojIHX38GMQ	The French Riviera - Côte d'Azur France - 4K Cinematic Travel Video
KkmNY5lM4GQ	Sobrecoxa de Frango com Chimichurri e Batata com Sour Cream do Netão! | Netão! Bom Beef #50
X5oD_thIk3c	How To Cook Perfect Eggs Every Time
0VQEJARHJ44	How to make... One Pan Pasta!
FsanXr238_k	Como fazer o melhor pão italiano!
6vebbDZxoKE	5 Min vs. 50 Min vs. 5 Hour Pasta (ft. Binging With Babish) • Tasty
ChzUN_RvMeY	Family Ragu with Gennaro Contaldo
1-SJGQ2HLp8	How to Make Perfect Pizza | Gennaro Contaldo
h5gcJjOSDv4	How To... cook steak, with Jamie Oliver's mate Pete
rbmsVTe-zkw	Tomato Relish l Tomato relish recipe
NHPhnFULXXs	Bifes de lombo de porco à manteiga de alecrim
APy5tsosXx4	Mykonos Greece From Drone Perspective  🇬🇷 DJI Mavic 2 pro
VpwtfwycNVo	Khoya Gulab jamun recipe | How to make gulab jamun
x64gbjmtnHM	Gennaro’s Family Lasagne
FVKcW78FtPk	RECEITA: O MELHOR MOUSSE DE CHOCOLATE DO MUNDO
-gF8d-fitkU	Easy Bolognese Recipe | Jamie Oliver
Yw-FSUEc8Pc	How To Make Chocolate Donuts | Gordon Ramsay
5Sa9nYKiYg0	The Original Orange Chicken by Panda Express
Il0z3nNRuC0	El Camino: A Breaking Bad Film | Teaser | Netflix
qJb2KPsOPVU	O MELHOR PETISCO DO MUNDO! | BOLINHOS DE BECHAMEL COM PRESUNTO E QUEIJO!
lWaBh-r2ZP0	3 Minute Tomato Pasta Sauce | Jamie Oliver & Davina McCall
0KpiuwhmCm4	Meatballs | Jamie Oliver | 20 Years of The Naked Chef
jd16yRTsP8k	20 FATOS SOBRE DARK, A SÉRIE ALEMÃ DO NETFLIX - Alemanizando
X6VtO8BDsQ8	COMO FAZER PÃO CASEIRO
umCKzvIaWwA	COMO FAZER BOLINHO DE ARROZ
mazRI6SUxX4	Detalhes de GAME OF THRONES 8x06 - O que foi escrito?
Hvw7K0s7xE8	COMO FAZER BRIGADEIRÃO
E4lv-od2_Ls	You'll Never Eat French Fries the Same Way Again 😮🍟 | Tastemade Staff Picks
rWJSk1i8sLY	COMO FAZER TORTA DE LIMÃO
CAs60fSOhw0	COMO FAZER CHEESECAKE COM CALDA DE GOIABADA
VtPf3aYaBNs	Game of Thrones Watch Party Recipes | The Hound's Fried Chicken
C_C2sUAc1tY	RECEITA DE ARROZ DE FORNO FÁCIL
HUvctvzhitg	COMO FAZER ESFIRRA DE CARNE
4L8AcrAYrEw	3 MELHORES DOCES COM PAÇOCA DA TASTEMADE
75iExVNvrWw	Kawhi Leonard Wins The Series At The Buzzer! | May 12, 2019
1eYfW2tJK5Q	3 RECEITAS DA TASTEMADE COM MUITO QUEIJO
k72JxgIeWL0	COMO FAZER BOLO DE FUBÁ SUPER CREMOSO
NFa85dBx4C8	COMO FAZER BOLINHO DE CHUVA
QwLPjI_jMTo	Cacio E Pepe Pizza With Daniele Uditi | Like A Chef
FXk3VdQvTHw	COMO FAZER CHANTILLY EM CASA
cJZOfEOqKxM	RECEITA DE PUDIM DE LEITE CONDENSADO PERFEITO SEM FURINHOS
gf0qj6zPe-8	2 QUIBES DE FORNO
bqHAasBZETQ	3 MELHORES BOLINHOS DE CHUVA DA TASTEMADE
dBvsArke3L8	Austrian Fried Chicken I Backhendl - I´m from Austria #4 - Weber Master Touch GBS Premium Grill
iFrP6qdSFmc	CARBONARA | MINHA MASSA FAVORITA!
