ABjTq6EMtzM	4 Easy Egg Recipes For Breakfast
8pGP-Ew7YOg	BATATA AO FORNO DA VOVÓ!
MSKLX8qFIjU	O MEU QUEIJO QUENTE PREFERIDO!
aEDYW5GfdXI	INFÂNCIA | AHAVAH (CLIPE OFICIAL)
qYf3P1BvrzE	MOLHO PESTO SIMPLES E FÁCIL
s1ja3lQZrIM	MAIONESE DE ALHO PERFEITA!
g1sIKcRfnG8	Frango Crocante com Creme de Milho - COMIDAS FAVORITAS 02
zsixDhAEyjk	PÃO DE QUEIJO COM AVEIA com Luanda Gazoni
GjmZIp0amfQ	COOKIE RECHEADO | Melhores Receitas Tastemade
MQJzkUVdPiQ	BROWNIE DE CHOCOLATE COM LEITE CONDENSADO | Melhores Receitas Tastemade
eu3PPmgRzBI	CAPRESE CREMOSA NA TRAVESSA | Melhores Receitas Tastemade
XmYJBInVzQg	PICANHA RECHEADA | Melhores Receitas Tastemade
2NLgXZqMK6o	FOCACCIA DE FRANGO | Melhores Receitas Tastemade
FuMuuS6kwgQ	COMO FAZER MOLHO PESTO | Master Of Pasta
